page,1
ಕಾಲು ದೀಪ/ದೀಪದ ಕಾಲು,"ಸೀಮೆಎಣ್ಣೆ ಬುಡ್ಡಿ, ಹಣತೆ ಮುಂತಾದ ದೀಪಗಳನ್ನು ಎತ್ತರದಲ್ಲಿ ಇರಿಸಲು ಬಳಸುವ ಮರದ ಸಾಧನ. ಇದು ಸುಮಾರು ಒಂದರಿಂದ ಐದು ಅಡಿ ಎತ್ತರವಿರುತ್ತದೆ. ಇದರ ಕೆಳಭಾಗವನ್ನು ಕೆಳಪೀಠವೆಂದೂ ಅತೀ ಮೇಲಿನ ಭಾಗವನ್ನು ಮೇಲು ಪೀಠವೆಂದೂ ಕರೆಯುತ್ತಾರೆ. ದೀಪಗಳನ್ನು ಅಗತ್ಯವಾದ ಎತ್ತರದಲ್ಲಿ ಇರಿಸಿಕೊಳ್ಳಲು ಅನುಕೂಲವಾಗುವಂತೆ ಇದರ ಪಟ್ಟಿಗೆ(ಗರಗಸಾಕಾರದ ಮರದ ತುಂಡು) ಕೊಕ್ಕೆಗಳುಳ್ಳ ಅಡ್ಡಪಟ್ಟಿಯನ್ನು ಜೋಡಿಸಿ ಕೊಳ್ಳುವ ಅದರಲ್ಲಿ ದೀಪವಿರಿಸುವ ತಂತ್ರಜ್ಞಾನವೂ ಜನಪದರಲ್ಲಿ ರೂಢಿಯಲ್ಲಿದೆ. ಕೆಳಪೀಠದ ಮೇಲಿನ ಭಾಗವನ್ನು ಪಟ್ಟಿಯೆಂದೂ ಅತೀ ಮೇಲಿನ ಭಾಗವನ್ನು ಮೇಲು ಪೀಠವೆಂದೂ ಕರೆಯುತ್ತಾರೆ."
ಕುಂಕುಮದ ಭರಣಿ/ಬಟ್ಲು,"ಅರಸಿನ ಮತ್ತು ಕುಂಕುಮಗಳನ್ನು ಹಾಕಿ ಇಡಲು ಬಳಸುವ ಸಾಧನ. ವೃತ್ತಾಕಾರದಲ್ಲಿದ್ದು ಆಲಂಕಾರಿಕವಾಗಿ ಕೆತ್ತನೆ ಮಾಡಿದ್ದಾರೆ. ಸಣ್ಣ ಹಿಡಿಕೆಯಂಥ ರಚನೆ ಇರುವ ಮುಚ್ಚಳ ಇದೆ. ಮುಚ್ಚಳದಲ್ಲೂ ಆಲಂಕಾರಿಕ ಕೆತ್ತನೆ ಇದೆ. ಇವುಗಳ ಗಾತ್ರದಲ್ಲಿ ವ್ಯತ್ಯಾಸಗಳಿರುತ್ತವೆ. ದೇವರ ಪೂಜೆಯ ಸಂದರ್ಭಗಳಲ್ಲಿ, ದಿನಬಳಕೆಯಲ್ಲಿ, ಮಹಿಳಾ ಅತಿಥಿಗಳು ಬಂದಾಗ ಇದು ಉಪಯೋಗವಾಗುತ್ತದೆ. ವೃತ್ತ, ಆಯತ, ಕೂರ್ಮಾಕಾರಗಳಲ್ಲಿ ಕುಂಕುಮ ಬಟ್ಲುಗಳು ವಿನ್ಯಾಸಗೊಂಡಿರುತ್ತವೆ. ಕುಂಕುಮದ ಕರಡಿಗೆಗಳ ಒಳಗೆಯೇ ಕುಂಕುಮ, ಅರಸಿಣ, ಕೇಸರಿ, ಗುಲಾಬಿ ಬಣ್ಣಗಳ ಹುಡಿಗಳನ್ನು ಇರಿಸಿಕೊಳ್ಳಲು ಯೋಗ್ಯವಾಗುವಂತೆ ಅಳವಡಿಸಿ ಅವಕ್ಕೆ ಬೇರೆ ಬೇರೆಯೇ ಮುಚ್ಚಳುಗಳನ್ನು ಕೌಶಲದಿಂದ ಅಳವಡಿಸಲಾಗುತ್ತದೆ. ಸಾಗುವಾನಿ, ಶ್ರೀಗಂಧ, ಹಲಸು ಮುಂತಾದ ಮರಗಳಿಂದ ಇಂಥ ಬಟ್ಟಲುಗಳನ್ನು ತಯಾರಿಸುತ್ತಾರೆ."
ಕುಟಾಣಿ/ಕುಟ್ನಿ,"ಎಲೆ ಅಡಿಕೆ ಕುಟ್ಟಿಕೊಳ್ಳಲು ಬಳಸುವ ಲೋಹದ ಸಾಧನ. ಇದು ಒರಳಿನ ಆಕಾರವಿದ್ದು, ಎತ್ತರ ಸುಮಾರು ನಾಲ್ಕು ಇಂಚು. ಒರಳಿನ ಆಳ ಸುಮಾರು ಮೂರುವರೆ ಇಂಚು. ಇದಕ್ಕೆ ಪೂರಕವಾಗಿ ಒಂದು ಅಡಿ ಉದ್ದದ ಕಬ್ಬಿಣದ ಕೋಲು ಇದೆ. ಇದರ ಬುಡ ದಪ್ಪವಿದ್ದು ತುದಿಗೆ ಹೋದಂತೆಲ್ಲಾ ಗಾತ್ರದಲ್ಲಿ ಚಿಕ್ಕದಾಗುತ್ತದೆ. ತುದಿ ದುಂಡಗಿರುತ್ತದೆ. ಅಡಿಕೆ ಎಲೆಅಡಕೆ ತಿನ್ನುವ ಅಭ್ಯಾಸ ಉಳ್ಳವರು, ಅದರಲ್ಲೂ ಬಾಯಲ್ಲಿ ಹಲ್ಲಿಲ್ಲದವರು ಇದನ್ನು ಎಲೆಅಡಕೆ ಕುಟ್ಟಿಕೊಳ್ಳಲು ಬಳಸುತ್ತಾರೆ. ಇನ್ನಿತರ ಸಣ್ಣ ಪ್ರಮಾಣದ ಘನವಸ್ತುಗಳನ್ನು ಪುಡಿಮಾಡಲು ಕೂಡ ಇದು ಉಪಯೋಗವಾಗುತ್ತದೆ. ಇದರ ಸ್ವರೂಪದಲ್ಲಿ ವ್ಯತ್ಯಾಸ ಕಂಡು ಬರುತ್ತವೆ."
page,2
ಕುಡುಗೋಲು/ಕತ್ತಿ,"ಪೈರುಗಳ ಕಟಾವಿಗೆ, ಸೊಪ್ಪು, ಹುಲ್ಲು, ಕಳೆ ಇತ್ಯಾದಿಗಳನ್ನು ಕತ್ತರಿಸಲು ಬಳಸುವ ಸಾಧನ. ಇದಕ್ಕೆ ಮರದ ಹಿಡಿ, ಕಬ್ಬಿಣದ ಅಲಗು. ಅಲಗು ಬಾಗಿರುವುದರಿಂದ ಇದಕ್ಕೆ ಕುಡುಗೋಲು ಎಂಬ ಹೆಸರು. ಇದನ್ನು ಕಮ್ಮಾರರು ಪಾರಂಪರಿಕವಾಗಿ ತಯಾರಿಸುತ್ತಾರೆ. ಇದು ಬಾಗಿರುವುದರಿಂದ ಪೈರು ಮತ್ತು ಹುಲ್ಲಿನಂತಹ ಬೆಳೆಗಳನ್ನು ಕತ್ತರಿಸಲು ಅನುಕೂಲಕರವಾಗಿದೆ. ತರಕಾರಿ ಮತ್ತು ಮಾಂಸ ಹೆಚ್ಚುವುದಕ್ಕೂ ಬಳಕೆಯಾಗುತ್ತದೆ. ಇವುಗಳಲ್ಲಿ ನಾನಾ ಪ್ರಕಾರ/ಗಾತ್ರಗಳಿರುತ್ತವೆ."
ಕುಂದಣಿಗೆ,"ಒರಳಿನಲ್ಲಿ ಕಾಳುಗಳನ್ನು, ಕಾರವನ್ನು ಕುಟ್ಟುವಾಗ ಕಾಳುಗಳು, ಕಾರ ಆಚೆ ಈಚೆ ಸಿಡಿದು ಹೋಗದಂತೆ ತಡೆಯಲು ಬಳಸುವ ಸಾಧನ. ಇದು ಚಕ್ರಾಕಾರದಲ್ಲಿದ್ದು ಸುಮಾರು ಒಂದು ಅಡಿ ಎತ್ತರ, ಕಂಠ ಸುಮಾರು ಎರಡು ಇಂಚು ದಪ್ಪ ಇರುತ್ತದೆ. ಸುಮಾರು ಇಪ್ಪತ್ತು ಇಂಚು ಸುತ್ತಳತೆ ಇದೆ. ಇದನ್ನು ಒರಳು ಕಲ್ಲಿನ ಮೇಲೆ ಇಟ್ಟು ಧಾನ್ಯಗಳನ್ನು ಕುಟ್ಟುತ್ತಾರೆ. ಇದರ ತಳಭಾಗ ಒರಳುಕಲ್ಲಿನ ಬಾಯ ಅಳತೆಗೆ ಹೊಂದಿಕೆಯಾಗುವಂತೆ ಇದ್ದು ಮೇಲ್ಭಾಗ ಸ್ವಲ್ಪ ಹೆಚ್ಚು ಅಗಲವಿರುತ್ತದೆ. ಕೆಲವೊಮ್ಮೆ ಇದರ ತಳಭಾಗದ ಸುತ್ತಲೂ ಸುಂದರ ಕೆತ್ತನೆ ಕೆಲಸ ಮಾಡಿರುತ್ತಾರೆ."
ಕುರ್ಚಿಗೆ,"ಕಳೆ ಕೀಳಲು ವ್ಯಾಪಕವಾಗಿ ಬಳಕೆಯಾಗುವ ಸಾಧನ. ಇದಕ್ಕೆ ಮರದ ಹಿಡಿ, ಕಬ್ಬಿಣದ ಅಲಗು. ಅಲಗಿನ ಮುಂಭಾಗವು ತೆಳುವಾಗಿರುವುದರಿಂದ ಮಣ್ಣಿನ ಮೇಲ್ಪದರದಲ್ಲಿ ಹಬ್ಬಿರುವ ಕಳೆ ಗಿಡಗಳ ಬೇರುಗಳನ್ನು ಕತ್ತರಿಸಲು ಯೋಗ್ಯವಾಗಿರುತ್ತದೆ. ಕುರ್ಚಿಗೆಗಳ ವಿನ್ಯಾಸಗಳಲ್ಲಿ ವ್ಯತ್ಯಾಸಗಳಿವೆ. ಬೆಳ್ಳುಳ್ಳಿಯ ಬೆಳೆಯಲ್ಲಿನ ಕಳೆಗಳನ್ನು ತೆಗೆಯಲು ಬಳಸುವ ಕುರ್ಚಿಗೆ ಚಿಕ್ಕದು. ಬಾಗಿದ ಅಲಗು ಒಟ್ಟು ಒಂದು ಅಡಿ ಉದ್ದವಿದೆ. ಬಾಗಿದ ಮುಂಭಾಗವು ಸಾಮಾನ್ಯವಾಗಿ ನಾಲ್ಕು ಇಂಚು ಉದ್ದವಿರುತ್ತದೆ. ಉಳುಮೆಯಾದ ನೆಲವನ್ನು ಸಮತಟ್ಟು ಮಾಡಲು ಮತ್ತು ಸಡಿಲು/ನುಸುಲುಗೊಳಿಸಲು ಬಳಸುವ ಕುಂಟೆಯಲ್ಲಿ ಸಿಕ್ಕಿಕೊಳ್ಳುವ ಬೇರು ನಾರುಗಳ ತೊಂದರೆಯನ್ನು ನಿವಾರಿಸಲು ಕೂಡ ಕುರ್ಚಿಗೆ ಬಳಕೆಯಾಗುತ್ತದೆ. ಕುರ್ಚಿಗೆಯನ್ನು ಹಳೆಯ/ಸವೆದ ಕುಡುಗೋಲುಗಳಿಂದಲೂ ತಯಾರಿಸಿಕೊಳ್ಳಬಹುದು."
ಕುಲಾವಿ/ಕುಲಾಯಿ,"ಬಿಸಿಲು, ಶೀತಬಾಧೆಯನ್ನು ತಡೆಯುವುದು ಇದರ ಮುಸಣ್ಣಮಕ್ಕಳಿಗೆ ತಲೆಗೆ ಕಟ್ಟಲು ಉಪಯೋಗವಾಗುವ ಬಟ್ಟೆಯ ಟೋಪಿ. ಚಿಕ್ಕಮಕ್ಕಳಿಗೆ ಇದನ್ನು ಕಟ್ಟುವುದರಿಂದ ಧೂಳು, ಖ್ಯ ಉದ್ದೇಶ. ಇದು ಪುಟ್ಟಮಕ್ಕಳಿಗೆ ಅಲಂಕಾರ ಸಾಧನವೂ ಹೌದು. ತಲೆಯ ಮೇಲ್ಭಾಗ ಮತ್ತು ಹಿಂಭಾಗವು ಆವೃತವಾಗುವಷ್ಟು ಗಾತ್ರದಲ್ಲಿ ಇದನ್ನು ರಚಿಸಿಕೊಂಡು ಕಿವಿಯ ಇಕ್ಕೆಲಗಳಿಂದಲೂ ಕೆಳಗಿಳಿಸಿ ಗಲ್ಲದ ಕೆಳಭಾಗದಲ್ಲಿ ಇದನ್ನು ಎರಡು ಕಸೆಗಳಿಂದ ಕಟ್ಟುತ್ತಾರೆ. ಇದು ವರ್ಣಮಯವಾಗಿರುತ್ತದೆ. ಇದರ ಮೇಲ್ಭಾಗ ಮತ್ತು ಅಂಚುಗಳುದ್ದಕ್ಕೂ ಪುಟ್ಟ ಪುಟ್ಟ ಕುಂಚಿಕೆಗಳನ್ನು ಹೆಣೆಯುತ್ತಾರೆ. ಇದು ಕೇವಲ ಅಲಂಕಾರದ ಉದ್ದೇಶವುಳ್ಳವು. ಮೃದುವಾದ ಹತ್ತಿ ಬಟ್ಟೆ ಅಥವಾ ಮೃದುವಾದ ಉಣ್ಣೆಬಟ್ಟೆಯಿಂದ ತಯಾರಿಸಿಕೊಳ್ಳುತ್ತಾರೆ.
ಹಸುಗೂಸಿಗೆ ತಾಯಿಯ ಕಡೆಯಿಂದ ಮೊದಲು ಕುಲಾವಿಯನ್ನು ಹೊಲಿಸಿಕೊಡಿಸುವ ಸಂಪ್ರದಾಯವಿದೆ. ಬೇರೆ ಬೇರೆ ತೆರನ ವಿನ್ಯಾಸದ ಮತ್ತು ಗುಣಮಟ್ಟದ ಸಿದ್ಧಟೊಪ್ಪಿಗೆಗಳು ಮಾರುಕಟ್ಟೆಗೆ ಬಂದಿರುವುದರಿಂದ ಹಳೆಯ ರೀತಿಯ ಕುಲಾವಿಗಳು ವಿರಳವಾಗುತ್ತಿವೆ. ಕುಲಾವಿಯ ಪ್ರತಿ ನೆಯ್ಗೆಯಲ್ಲೂ ವಾತ್ಸಲ್ಯವು ಅನಾವರಣಗೊಳ್ಳುತ್ತದೆ."
ಕೂರಿಗೆ ತಾಳು,ಕೂರಿಗೆ ತಾಳನ್ನು ಕೂರಿಗೆಯ ದಿಂಡಿನ ಕೆಳಭಾಗದಲ್ಲಿ ಜೋಡಿಸಲಾಗುತ್ತದೆ. ಇದು ಸುಮಾರು ಒಂದೂವರೆ ಅಡಿ ಉದ್ದವಿದೆ. ಕೂರಿಗೆ ತಾಳಿನ ಹಿಂಭಾಗದಲ್ಲಿನ ಒಂದು ಅಡಿ ಕೂರಿಗೆ ದಿಂಡಿಗೆ ಜೋಡಣೆಯಾಗುವಂತೆ ಆಯಾತಾಕಾರದಲ್ಲಿದ್ದು ಅದರ ಮುಂಭಾಗದ ಚೂಪಾದ ರಚನೆಯು ಭೂಮಿಯನ್ನು ಉಳುವುದಕ್ಕೆ ಉಪಯೋಗವಾಗುತ್ತದೆ. ಮರದ ತಾಳು ಸವೆಯಬಾರದೆಂಬ ಕಾರಣಕ್ಕೆ ಸುಮಾರು ಅರ್ದ ಅಡಿ ಉದ್ದದ ಕಬ್ಬಿಣದ ಕುಳವನ್ನು ಜೋಡಿಸಲಾಗುತ್ತದೆ. ಇದು ಕಿತ್ತು ಹೋಗದಂತೆ ಅದಕ್ಕೆ U ಆಕಾರದ ಜಿಗಳೆಯನ್ನು ಹೊಡೆದಿರುತ್ತಾರೆ. ಜಾಲಿ ಮುಂತಾದ ಗಟ್ಟಿಮರವನ್ನು ಕೂರಿಗೆ ತಾಳು ತಯಾರಿಸಲು ಬಳಸುತ್ತಾರೆ.
ಕೂರಿಗೆ ಬಟ್ಲು,"ಕೂರಿಗೆಗೆ ಬಿದಿರಿನ ಕೊಳವೆಯಾಕಾರದ ಬಂಬುಗಳನ್ನು ಜೋಡಿಸಿಕೊಂಡು ಕಾಳುಗಳನ್ನು ಬಿತ್ತನೆ ಮಾಡಲಾಗುತ್ತದೆ. ಇದರಿಂದ ನಿಶ್ಚಿತ ಜಾಗದಲ್ಲಿ, ನಿಶ್ಚಿತ ಪ್ರಮಾಣದಲ್ಲಿ ಕಾಳುಗಳು ಬಿತ್ತನೆಗೆ ಒದಗುತ್ತವ. ಕೂರಿಗೆ ಬಟ್ಟಲಿನ ಮೇಲ್ಭಾಗವು ಒಂದು ಬಾಣಲೆಯ ಆಕಾರದಲ್ಲಿರುತ್ತದೆ. ಅದರ ಕೆಳಭಾಗದಲ್ಲಿ ಮೂರು ಅಥವಾ ನಾಲ್ಕು ರಂಧ್ರಗಳು ಇರುತ್ತವೆ. ಈ ರಂಧ್ರಗಳಿಗೆ ಬಿದಿರಿನ ಕೊಳವೆಯಾಕಾರದ ಬಂಬುಗಳನ್ನು ಜೋಡಿಸುವ ಮೂಲಕ ಕಾಳುಗಳು ಕೂರಿಗೆಯ ಸಾಲುಗಳನ್ನು ಸೇರಿಕೊಳ್ಳುವಂತೆ ಮಾಡಲಾಗುತ್ತದೆ. ಕೂರಿಗೆ ಬಟ್ಟಲಿನ ವ್ಯಾಸವು ಬಿತ್ತುವ ಧಾನ್ಯಗಳ ಗಾತ್ರಾನುಸಾರ ಬದಲಾಗುತ್ತದೆ. ಸಿರಿಧಾನ್ಯಗಳನ್ನು ಬಿತ್ತುವುದಾದರೆ ಬಟ್ಟಲು ಚಿಕ್ಕದಾಗಿರುತ್ತದೆ. ಸಾಮಾನ್ಯವಾಗಿ ಕೂರಿಗೆ ಬಟ್ಟಲು ಸುಮಾರು ನಾಲ್ಕೂವರೆ ಇಂಚು ಎತ್ತರ, ಆರು ಇಂಚು ವ್ಯಾಸವಿರುತ್ತದೆ. ಕೂರಿಗೆ ಬಟ್ಟಲನ್ನು(ಬುಕ್ಕಗಳ ಸಹಿತ) ಗೊಬ್ಬರ ಹಾಕಲು, ಬೆಳ್ಳುಳ್ಳಿಯಂಥ ದೊಡ್ಡ ವಸ್ತುಗಳನ್ನು ಬಿತ್ತಲು, ಜೋಳ, ಹೆಸರು, ಉದ್ದು, ಗೋಧಿ ಮುಂತಾದ ಅತಿ ಕಿರುಕಾಳುಗಳನ್ನು ಬಿತ್ತಲೂ ಬಳಸಿಕೊಳ್ಳಲಾಗುತ್ತದೆ. ಹಿಂದೆಯೇ ಹೇಳಿದಂತೆ ಪ್ರಮಾಣಾನುಸಾರ ಬಟ್ಟಲಿನ ರಂಧ್ರ ಮತ್ತು ಗಾತ್ರಗಳಿರುತ್ತವೆ. ಕೂರಿಗೆ ಬಟ್ಟಲಿನ ಬಗೆಗೆ ರೈತರಲ್ಲಿ ಪೂಜ್ಯ ಭಾವನೆಯಿದೆ. ಅದನ್ನು ಬೋರಲು ಹಾಕುವುದು/ಕವುಚುವುದು, ತುಳಿಯುವುದು. ಒಡೆಯುವುದು, ಉರಿಸುವುದು-ಇತ್ಯಾದಿಗಳಿಗೆ ತೀವ್ರ ನಿಷೇಧವಿದೆ. ಕೂರಿಗೆ ಬಟ್ಟಲಲ್ಲಿ ಈ ಕಾರಣದಿಂದಲೇ ನಂದಿ, ಆಂಜನೇಯ, ಈಶ್ವರ, ಸೂರ್ಯ, ಚಂದ್ರ ಮುಂತಾದ ಚಿತ್ರಗಳನ್ನು ಕೆತ್ತನೆ ಮಾಡಿರುವುದು ಕಂಡುಬರುತ್ತದೆ. ಕೂರಿಗೆ ಬಟ್ಟಲುಗಳನ್ನು ಸಾಗುವಾನಿ, ಶಿವನೆ(ನಿ) ಹತ್ತಿಮರ, ಜಾಲಿ ಮುಂತಾದ ಮರಗಳಿಂದ ರಚಿಸುತ್ತಾರೆ. ಇತ್ತೀಚಿನ ದಿನಗಳಲ್ಲಿ ಟ್ರಾಕ್ಟರ್ ಮೂಲಕ ಕೂಡ ಫೈಬರಿನ ಕೂರಿಗೆ ಬಟ್ಲನ್ನು ಕಟ್ಟಿಕೊಂಡು ಬಿತ್ತನೆ ಮಾಡುತ್ತಾರೆ."
ಕೂರಿಗೆವ್ವ,"ಉತ್ತರ ಕರ್ನಾಟಕದಲ್ಲಿ ವರ್ಷಾರಂಭದ ಬಿತ್ತನೆ ಪ್ರಾರಂಭಿಸುವ ಮೊದಲು ಊರದೇವತೆಗಳ ಪೂಜೆ, ಅಗಸೆ ಪೂಜೆಯನ್ನು ಮಾಡಿದ ಬಳಿಕ ಗ್ರಾಮಸ್ಥರೆಲ್ಲರೂ ಸೇರಿ ಬಿತ್ತನೆ ಕಾರ್‍ಯಕ್ಕೆ ಮುನ್ನುಡಿಯಾಗಿ ಮೊದಲು ಮಾಡುವುದು ಎಂಬ ಆಚರಣೆಯನ್ನು ಮಾಡುತ್ತಾರೆ. ಬಳಿಕ ಆಯಾ ಮನೆಯವರು ತುಂಬಿದ ಕೊಡವೊಂದರ ಮೇಲೆ ಕೂರಿಗೆವ್ವನನ್ನು ಇರಿಸಿ ಅಲಂಕರಿಸಿ ಪೂಜಿಸಿ ತಮಗೆ ಸಮೃದ್ಧ ಮಳೆ-ಬೆಳೆ ನೀಡುವಂತೆ ಪ್ರಾರ್ಥಿಸುತ್ತಾರೆ. ಬಿತ್ತನೆಯ ಕೆಲಸಕ್ಕೆ ಕೂರಿಗೆಯು ಬಹಳ ಮುಖ್ಯ ಸಾಧನವಾಗಿರುವುದರಿಂದ ಈ ದೇವತೆಗೆ ಕೂರಿಗೆವ್ವನೆಂದೇ ಹೆಸರಾಗಿದೆ. ಕೂರಿಗೆವ್ವ ಮೂರ್ತಿಯಲ್ಲಿ ರುಂಡಮಾತ್ರ ಇದೆ. ಅದು ಸ್ತ್ರೀ ಮೂರ್ತಿ ಎನ್ನುವುದು ನಿಚ್ಚಳವಾಗುವಂತೆ ಕೆತ್ತನೆ ಮಾಡಿದ್ದಾರೆ. ಸುಮಾರು ಮನುಷ್ಯ ಮೋರೆಯಷ್ಟು ಗಾತ್ರವಿದೆ. ಕೂರಿಗೆವ್ವನ ಮೋರೆಯು ವರ್ಷದಲ್ಲಿ ಒಂದು ಬಾರಿ ಹೊರಗೆ ಬರುತ್ತದೆ. ಕೂರಿಗೆವ್ವನ ಮೂರ್ತಿಯನ್ನು ಸಾಗುವಾನಿ ಮರದಿಂದ ನಿರ್ಮಿಸಿದ್ದಾರೆ."
ಕೃಷ್ಣಚಕ್ರ,ಪೌರಾಣಿಕ ನಾಟಕದಲ್ಲಿ ಕೃಷ್ಣ/ವಿಷ್ಣು ಪಾತ್ರದಾರಿ ಬಳಸುವ ಒಂದು ಆಯುಧ. ಸುಮಾರು ಹನ್ನೆರಡು ಇಂಚು ಉದ್ದವಿದೆ. ಕೆಳಭಾಗದಲ್ಲಿ ಹಿಡಿಯಲು ಹಿಡಿಕೆಯಿದ್ದು ಮೇಲ್ಭಾಗ ಚಕ್ರಾಕಾರಹೊಂದಿದೆ. ಚಕ್ರವು ಸುಮಾರು ಆರೂವರೆ ಇಂಚು ವ್ಯಾಸವನ್ನು ಹೊಂದಿದೆ.
ಕೆರ್‍ಸಿ/ಗೆರಸೆ,"ಗ್ರಾಮೀಣ ಪ್ರದೇಶಗಳಲ್ಲಿ ಹಬ್ಬಹರಿದಿನ, ಜಾತ್ರೆ, ಉತ್ಸವ ಮುಂತಾದ ವಿಶೇಷ ದಿನಗಳಲ್ಲಿ ಕರಿದ ತಿಂಡಿಗಳನ್ನು ಹಾಕಿಡಲು ಬಳಸುವ ಪರಿಕರ. ಇದು ಸುಮಾರು ಐದು ಇಂಚು ಎತ್ತರವಿದ್ದು ಸುಮಾರು ಹದಿಮೂರು ಇಂಚು ವ್ಯಾಸವಿರುತ್ತದೆ. ಇದನ್ನು ಬೆತ್ತದಿಂದ ಹೆಣೆದು ಗೇರೆಣ್ಣೆಯನ್ನು ಹಚ್ಚಲಾಗಿರುತ್ತದೆ. ವಿಶೇಷ ದಿನಗಳಲ್ಲಿ ಬಜ್ಜಿ, ಬೋಂಡ, ವಡೆ, ಮಿರ್ಚಿ ಮುಂತಾದ ಎಣ್ಣೆಯಲ್ಲಿ ಕರಿದ ತಿಂಡಿಗಳನ್ನು ಹಾಕಿಡಲು ಬಳಸುತ್ತಾರೆ. ಬೆತ್ತದ ಕೆರ್‍ಸಿಗಳಲ್ಲಿ ಹಾಕಿರಿಸಿದ ಕರಿದ ತಿಂಡಿಗಳು ಬಹಳ ಬೇಗ ಕೆಡುವುದಿಲ್ಲ. ಗಾಳಿ ಚೆನ್ನಾಗಿ ಆಡುತ್ತದೆ. ಕೆರ್‍ಸಿಯನ್ನು ಆಯತಾಕಾರದಲ್ಲಿ ಹೆಣೆಯಲಾಗುತ್ತದೆ."
ಕೈಗರಗಸ,ಮರದ ಸಣ್ಣ ಹಲಗೆಗಳನ್ನು ಹಾಗೂ ಸಣ್ಣ ಕಟ್ಟಿಗೆಗಳನ್ನು ತುಂಡು ಮಾಡಿಕೊಳ್ಳಲು ಬಳಸುವ ಸಾಧನ. ಇದು ಸುಮಾರು ಎರಡು ಅಡಿ ಉದ್ದವಿರುತ್ತದೆ. ಇದನ್ನು ಹಿಡಿಯಲು ಹಿಂಭಾಗದಲ್ಲಿ ಹಿಡಿಯನ್ನು ಹೊಂದಿರುತ್ತದೆ. ಹಿಡಿಯಿಂದ ಅಗಲ ಪಟ್ಟಿಯನ್ನು ಹೊಂದಿ ಮುಂದುವರಿದಂತೆಲ್ಲ ಅದರ ಅಗಲವು ಕಡಿಮೆಯಾಗುತ್ತದೆ. ಆಯತಾಕಾರದ ಪಟ್ಟಿಯ ಒಂದು ಪಾರ್ಶ್ವದಲ್ಲಿ ಮುಳ್ಳುಗಳ ಎಡೆಬಿಡದೆ ಇರುವ ಆಕಾರ ಹೊಂದಿರುತ್ತದೆ. ಹೀಗೆ ಮಾಡಿರುವುದರಿಂದ ಕಟ್ಟಿಗೆ ಕೊರೆಯುವಾಗ ಗರಗಸ ಹಿಂದು ಮುಂದೆ ಸರಿದಾಡಲು ಅನುಕೂಲವಾಗುತ್ತದೆ. ಇದರ ಮುಳ್ಳುಗಳು(ಹಲ್ಲುಗಳು) ಅಲ್ಪಸ್ವಲ್ಪ ಬಾಗಿರುತ್ತವ.
ಕೈಪೆಟ್ಟಿಗೆ/ಆಭರಣ ಪೆಟ್ಟಿಗೆ,"ಬೆಲೆಬಾಳುವ ಒಡವೆ ಮತ್ತು ಹಣವನ್ನು ಸಂರಕ್ಷಿಸಲು ಬಳಸುವಂತಹ ಸಾಧನ. ಸುಮಾರು ಏಳು ಇಂಚು ಅಗಲ, ಹತ್ತೂವರೆ ಇಂಚು ಉದ್ದ, ಮೂರೂವರೆ ಇಂಚು ಎತ್ತರವನ್ನು ಹೊಂದಿ ಆಯತಾಕಾರದಿಂದ ಕೂಡಿದೆ. ಬೀಗ ಹಾಕುವ ವ್ಯವಸ್ಥೆ ಹೊಂದಿದೆ. ಇದನ್ನು ಒಂದುಕಡೆಯಿಂದ ಮತ್ತೊಂದು ಕಡೆಗೆ ಕೊಂಡೊಯ್ಯಲು ಮೇಲ್ಭಾಗದಲ್ಲಿ ಹಿಡಿಯೂ ಇದೆ. ಹಣ ಒಡವೆಗಳನ್ನು ಕಳ್ಳ ಕಾಕರಿಂದ ಸಂರಕ್ಷಿಸಲು ಈ ಪೆಟ್ಟಿಗೆ ಬಳಕೆಯಾಗುತ್ತಿತ್ತು. ಇದನ್ನು ಲೋಹದಿಂದ (ಕಬ್ಬಿಣ) ತಯಾರಿಸಿದ್ದಾರೆ. ಈಗ ಈ ತರಹದ ಪಟ್ಟಿಗೆಗಳ ಬಳಕೆ ಕಡಿಮೆ."
ಕೈಹಂಚಿನ ಪಡಿಯಚ್ಚು,"ಮನೆಯ ಮೇಲ್ಛಾವಣಿಗೆ ಬಳಸುವ ಹಂಚುಗಳ ಪಡಿಯಚ್ಚು ತಯಾರಿಸಲು ಇದರಿಂದ ತಯಾರಿಸಲಾದ ಹಂಚುಗಳನ್ನು ಕರಿಹಂಚು/ಕೈಹಂಚುಗಳು ಎನ್ನುತ್ತಾರೆ. ಈ ಅಚ್ಚು ಸುಮಾರು ಒಂದೂವರೆ ಅಡಿ ಉದ್ದವಿದ್ದು ಅದರ ಹಿಂಭಾಗದಲ್ಲಿ ಹಿಡಿಕೆ ಇದೆ. ಅಚ್ಚು ದಪ್ಪವಾಗಿದ್ದು, ತುದಿಗೆ ಹೋದಂತೆ ಕಿರಿದಾಗುತ್ತದೆ. ಹಂಚುಗಳನ್ನು ತಯಾರಿಸುವಾಗ ಕೈಯಚ್ಚಿನ ಮೇಲೆ ಅರ್ಧಗೋಲಾಕಾರದಲ್ಲಿ ಮಣ್ಣನ್ನು ಮೆತ್ತಲಾಗುತ್ತದೆ. ಅಲ್ಲದೆ ಮನೆಯ ನೆಲವನ್ನು ಭದ್ರಗೊಳಿಸಲು, ನೆಲಸಮತಟ್ಟು ಮಾಡಲು ಸಹ ಕೈಯಚ್ಚು ಬಳಕೆಯಾಗುತ್ತದೆ. ಇದನ್ನು ಜಾಲಿಮರದಿಂದ ತಯಾರಿಸಲಾಗುತ್ತದೆ. ಹಂಚಿನ ಕಾರ್ಖಾನೆಗಳು ಬಂದ ಬಳಿಕ ಇದರ ಬಳಕೆ ಇಲ್ಲವಾಗಿದೆ."
ಕೊಡತಿ,"ಬಡಿಗಿ ವೃತ್ತಿಯವರು ಮರಕ್ಕೆ ರಂಧ್ರ ತೋಡುವಾಗ/ಹಾಕುವಾಗ ಉಳಿಯನ್ನು ಬಳಸುತ್ತಾರೆ. ಆ ಉಳಿಯನಿಟ್ಟು ಹೊಡೆಯುವುದಕ್ಕೆ ಬಳಸುವ ಪರಿಕರವೇ ಕೊಡತಿ. ಅಂದರೆ ಮೊಳೆ, ಉಳಿ ಮುಂತಾದವನ್ನು ಮೇಲಿನಿಂದ ಬಡಿಯಲು/ಕುಟ್ಟಲು ಬಳಸುವ ಸಾಧನ. ಉಳಿಗೆ ಪೆಟ್ಟು ಹೊಡೆಯಲು ಇದನ್ನು ಬಳಸುತ್ತಾರೆ. ಇದು ಸುಮಾರು ಒಂದು ಅಡಿ ಉದ್ದವಿದ್ದು ಹಿಡಿಯನ್ನು ಹೊಂದಿದೆ. ಹಿಡಿಯನ್ನು ಹೊರತು ಪಡಿಸಿ ಅದರ ಮುಂಭಾಗ ದಪ್ಪವಾಗಿದ್ದು ಭಾರವಾಗಿದೆ. ಒಕ್ಕುಲು ಸಂದರ್ಭದಲ್ಲಿ ಅಲಸಂಡೆ, ಹೆಸರು, ತೊಗರಿ ಬುಡ್ಡಿ ಬಡಿಯಲು ಸಹ ಅಪೂರ್ವವಾಗಿ ಬಳಕೆಯಾಗುತ್ತದೆ. ಇದರ ಗಾತ್ರದಲ್ಲಿ ಹಲವಾರು ವ್ಯತ್ಯಾಸಗಳಿವೆ. ಜಾಲಿ, ಹುಣಸೆ ಮರದಿಂದ ಇದನ್ನು ತಯಾರಿಸಿಕೊಳ್ಳುತ್ತಾರೆ."
ಕೊಡಲಿ,"ಕೊಡಲಿಯನ್ನು ರೈತರು ಮರ ಕಡಿಯಲು, ಕಟ್ಟಿಗೆ/ಸೌದೆ ಒಡೆಯಲು ಬಳಸುತ್ತಾರೆ. ಕೊಡಲಿಯು ಕಬ್ಬಿಣ ಹಾಗೂ ಮರದಿಂದ ತಯಾರಿಸಿದ ಆಯುಧ. ಕೊಡಲಿಯ ಅಲಗಿನ ತುದಿಯು ಹರಿತವಾಗಿದ್ದು ಅದರ ಬುಡದಲ್ಲಿ ಹಿಡಿಕೆಯನ್ನು ಜೋಡಿಸಿಕೊಳ್ಳಲು ಅನುಕೂಲವಾಗುವಂತೆ ರಚನೆಯಿರುತ್ತದೆ. ಎರಡು ಇಂಚು ಕೊಳವೆಗೆ ಎರಡೂವರೆ ಅಡಿ ಉದ್ದದ ಹಿಡಿಕೆ ಹಾಕಲಾಗಿರುತ್ತದೆ. ಕೊಡಲಿಗಳ ಗಾತ್ರ ಮತ್ತು ವಿನ್ಯಾಸಗಳಲ್ಲಿ ಸಾಕಷ್ಟು ವ್ಯತ್ಯಾಸವಿರುತ್ತದೆ."
ಕೊಣಮಿಗೆ,"ರೊಟ್ಟಿ ಮಾಡುವುದಕ್ಕೆ, ಹಿಟ್ಟು ಕಲಸಿಕೊಳ್ಳಲು ಮತ್ತು ಆ ಬಳಿಕ ರೊಟ್ಟಿ ಬಡಿಯಲು/ತಟ್ಟಲು ಬಳಸಿಕೊಳ್ಳುತ್ತಾರೆ. ಇದರ ಆಕಾರ ಮತ್ತು ಗಾತ್ರಗಳಲ್ಲಿ ವ್ಯತ್ಯಾಸ ಇರುತ್ತದೆ. ವೃತ್ತಾಕಾರದ ಕೊಣಮಿಗೆಯು ರೊಟ್ಟಿ ತಯಾರಿಸಿಕೊಳ್ಳಲು ಬಳಕೆಯಾದರೆ ಆಯತಾಕಾರದವುಗಳಲ್ಲಿ ಅನ್ನ ಮೊಸರು ಕಲಸಿಕೊಳ್ಳಲು ಬಳಕೆಯಾಗುತ್ತದೆ. ಇವನ್ನು ಕಗ್ಗಲ್ಲು, ಮರ ಮತ್ತು ಲೋಹಗಳಿಂದ ತಯಾರಿಸುತ್ತಾರೆ. ಸಾಗುವಾನಿ, ಮಾವು, ಅತ್ತಿ ಮುಂತಾದ ಮರಗಳು ತಯಾರಿಕೆಗೆ ಬಳಕೆಯಾಗುತ್ತವ. ರೊಟ್ಟಿ ಮಾಡುವ ಯಂತ್ರವು ಬಂದ ಮೇಲೆ ಕೊಣಮಿಗೆ ಬಳಕೆ ಕಡಿಮೆಯಾಗುತ್ತಾ ಬಂದಿದೆ."
