page,1
ಕೋಡಣಸು/ಕೊಡಂಚು,"ಎತ್ತಿನ ಕೋಡುಗಳ ತುದಿಗೆ ಅಲಂಕಾರಕ್ಕಾಗಿ ಬಳಸುವ ಪುಟ್ಟ ಸಾಧನ. ಇವು ಕೊಳವೆಯ ಆಕಾರದಲ್ಲಿದ್ದು ಅದರ ತುದಿಯು ದುಂಡಾಕಾರ/ಪುಟ್ಟ ಕಳಸಾಕಾರದಲ್ಲಿರುತ್ತದೆ. ಕೋಡಣಸುಗಳ ಬುಡದಲ್ಲಿ ಎರಡು ಪುಟ್ಟ ರಂಧ್ರಗಳಿದ್ದು ಅವುಗಳ ಮೂಲಕ ಮೊಳೆ/ತಂತಿಗಳನ್ನು ಕೋಡಿನ ತುದಿಯಲ್ಲಿ ಕೊರೆದ ಪುಟ್ಟರಂಧ್ರದೊಳಗೂ ಬರುವಂತೆ ಹಾಯಿಸಿ ತಂತಿಯ ತುದಿಗಳನ್ನು ಒಳಕ್ಕೆ ಬಾಗಿಸಲಾಗುತ್ತದೆ. ಕೋಡಣಸುಗಳು ಸುಮಾರು ಎರಡರಿಂದ ಐದು ಇಂಚುಗಳಷ್ಟು ಉದ್ದವಿರುತ್ತವೆ. ಇವುಗಳ ಸುತ್ತಲೂ ಅಲಂಕಾರಕ್ಕಾಗಿ ಕಿರು ಪ್ರಮಾಣದ ಕುಸುರಿ ಕೆಲಸ ಮಾಡಿರುವುದೂ ಕಂಡುಬರುತ್ತದೆ.
ಕೋಡಣಸುಗಳನ್ನು ಎತ್ತುಗಳಿಗೆ ಸಾಮಾನ್ಯವಾಗಿ ನಿತ್ಯವೂ ತೊಡಿಸುತ್ತಾರೆ. ಕೆಲವೆಡೆ ಕಾರಹುಣ್ಣಿಮೆಯ ಹಬ್ಬದಂದು ಕರಿಹೋರಿಗೆ ಚಿನ್ನ ಬೆಳ್ಳಿಯ ಕೋಡಣಸುಗಳನ್ನು ತೊಡಿಸಿ ಬಂಗಾರದ ಗೆಜ್ಜೆಗಳಿಂದ ಅಲಂಕರಿಸುವ ಸಂಭ್ರಮೋಪೇತ ಆಚರಣೆ ನಡೆಯುತ್ತಿತ್ತು. ಹಬ್ಬ, ಮೆರವಣಿಗೆಗಳಂಥ ಸಂದರ್ಭಗಳಲ್ಲಿ ಎತ್ತುಗಳ ಕೊಂಬುಗಳ ತುದಿಗೆ ಕೋಡಣಸನ್ನು ಹಾಕಿ ಅವುಗಳ ತುದಿಗೆ ಉಣ್ಣೆಯ ಗೊಂಡೆಗಳನ್ನು ಕಟ್ಟಿ ಇನ್ನಷ್ಟು ಅಂದವಾಗಿ ಅಲಂಕಾರ ಮಾಡುತ್ತಾರೆ. ಕೋಡಣಸುಗಳನ್ನು ಅಲಂಕಾರಕ್ಕಾಗಿ ಮಾತ್ರ ಬಳಸದೆ ಎತ್ತುಗಳು ಪರಸ್ಪರ ಇರಿಯುವಾಗ, ಮನುಷ್ಯರಿಗೆ ಹಾಯುವಾಗ, ಹೆಚ್ಚಿನ ಅಪಾಯವನ್ನು ತಪ್ಪಿಸುವುದಕ್ಕಾಗಿಯೂ ಬಳಸಲಾಗುತ್ತದೆ. ಕೋಡಣಸುಗಳನ್ನು ಅಲ್ಯೂಮಿನಿಯಂ, ಕಂಚು/ಹಿತ್ತಾಳೆ, ಬೆಳ್ಳಿ, ಬಂಗಾರಗಳಿಂದ ಕೂಡ ತಯಾರಿಸುತ್ತಾರೆ. ಅಮೂಲ್ಯ ಲೋಹಗಳ ಕೋಡನಸುಗಳನ್ನು ಅಪೂರ್ವ ಸಂದರ್ಭಗಳಲ್ಲಷ್ಟೇ ಬಳಸುತ್ತಾರೆ."
ಕೋಲಾಟದ ಕೋಲುಗಳು,"ಕೋಲಾಟದಲ್ಲಿ ಬಳಸುವ ವಸ್ತುಗಳು. ಇವು ಸುಮಾರು ಹದಿನಾಲ್ಕು ಇಂಚು ಉದ್ದ, ಮೂರು ಇಂಚು ಸುತ್ತಳತೆ ಹೊಂದಿವ. ಜನಪದ ಕಲೆಯಾದ ಕೋಲಾಟದಲ್ಲಿ ಒಬ್ಬರು ಮತ್ತೊಬ್ಬರೊಂದಿಗೆ ಕೋಲು ಹಾಕಲು ಬಳಸುವ ಈ ಕೋಲುಗಳ ನಾದವು ಜೋರಾಗಿಯೂ ಹಿತಕರವಾಗಿಯೂ ಇರುತ್ತದೆ. ಇವುಗಳನ್ನು ಅತ್ತಿಮರದಿಂದ ಕಲಾವಿದರೇ ತಯಾರಿಸಿಕೊಳ್ಳುತ್ತಾರೆ. ಕೋಲು ಕತ್ತರಿಸುವಾಗ ಹಾಗೂ ಆಟ ಮುಗಿದಾಗ ವಿಶಿಷ್ಠ ಬಗೆಯ ವಿಧಿ-ನಿಷೇಧ, ಪದ್ಧತಿ ಆಚರಣೆಗಳ ಚೌಕಟ್ಟಿನಲ್ಲಿ ನಡೆಯುವುದು ಗಮನಾರ್ಹ."
ಕ್ವಿಂಟಾಲ್ ಬುಟ್ಟಿ/ಗೂಡೆ,"ಜೋಳ, ರಾಗಿ, ಭತ್ತ, ಮುಂತಾದ ದವಸ ಧಾನ್ಯಗಳನ್ನು ತುಂಬಿಡಲು ಇದನ್ನು ಬಳಸುತ್ತಾರೆ. ಸುಮಾರು ಎರಡೂವರೆ ಅಡಿ ಅಗಲವಿದ್ದು ಸುಮಾರು ಒಂದೂವರೆ ಅಡಿ ಎತ್ತರವಿದೆ. ತಳಭಾಗವು ಸಮತಟ್ಟಾಗಿದ್ದು ಒಂದೂವರೆ ಅಡಿ ವ್ಯಾಸವಿದೆ. ಈ ಬುಟ್ಟಿಯನ್ನು ಬಿದಿರನ ಸೀಳುಗಳಿಂದ ಹೆಣೆಯಲಾಗಿದ್ದು ಇದಕ್ಕೆ ಹತ್ತಿ ಬಟ್ಟೆಯನ್ನು ಸುಟ್ಟು ಗೇರು ಎಣ್ಣೆಯಲ್ಲಿ ಮಿಶ್ರಣಮಾಡಿ ಸವರಿರುತ್ತಾರೆ. ಇದು ಬುಟ್ಟಿಗಳಲ್ಲಿಯೇ ಅತ್ಯಂತ ದೊಡ್ಡದು. ಈ ಬುಟ್ಟಿಯಲ್ಲಿ ಸುಮಾರು ಒಂದು ಕ್ವಿಂಟಾಲ್ ಧಾನ್ಯಗಳನ್ನು ಸಂಗ್ರಹಿಸಬಹುದು. ಇದನ್ನು ರೈತರು ಕ್ವಿಂಟಾಲ್ ಬುಟ್ಟಿ ಎಂದೇ ಕರೆಯುತ್ತಾರೆ. ಈ ಬುಟ್ಟಿಯನ್ನು ಕಣದಲ್ಲಿನ ಕಾಳುಗಳನ್ನು ಮನೆಗೆ ತಂದು ಹಾಕುವುದಕ್ಕೂ ಹೊಲದಲ್ಲಿ ಜೋಳ, ಸಜ್ಜೆ, ತೆನೆಗಳನ್ನು ಹೊತ್ತು ಹಾಕುವುದಕ್ಕೂ ಬಳಸುತ್ತಾರೆ. ಭತ್ತವನ್ನು ಅಕ್ಕಿಮಾಡಿಸಲು ಗಿರಣಿಗೆ ಹೊತ್ತುಕೊಂಡು ಹೋಗಲು ಕೂಡ ಬಳಸುತ್ತಾರೆ."
page,3
page,4
