page,1
ಧಗಂ,"ಧಸಕ್ ಎನ್ನುವಂತೆ ಅನುಕರಣ ಪದ (ನಿನ್ನನೊರ್ವನಂ ಪಗೆವಡೆಯೊಡ್ಡುಗಳಂ ಒಡೆಯಲ್ಕೆ ಪೇೞ್ದು ಎರ್ದೆ ಧಗಂ ಎನೆ ಸೈರಿಸುವ ಉಪಾಯಮಾವುದು ಕಱುವೇ: ಪಂಪಭಾ, ೧೧. ೯೧)"
ಧಗದ್ಧಗಿತರವ,"ಧಗಧಗ ಎಂಬ ಶಬ್ದ (ಧೃತಧಗದ್ಧಗಿತರವನಿರ್ಮಳಶಿಖಾಳಿಯಂ ಸತತಗತಿ ಪಥಮನಡರ್ವುಜ್ಜ್ವಳಜ್ವಾಳೆಯಂ: ಆದಿಪು, ೭. ೨೭ ವ)"
ಧನ,"ಹಣ (ದ್ರವಿಣಂ ದ್ರವ್ಯಂ ವಸು ಅರ್ಥ ವಿತ್ತ ರೈ ರಿಕ್ಥ ಸಾರ ಧನವೇಕಾರ್ಥಂ: ಅಭಿಧಾವ, ೧. ೬. ೧೨)"
ಧನಕೋಶ,"ಕೋಶಾಗಾರ (ಧನಕೋಶಂ ನವಹೇಮತಾಮರಸಕೋಶಂ ದೇಶಮಾಸೈಕತಾವನಿದೇಶಂ ಸಹಕಾರಿ ಸಾರಸಹಕಾರಂಮಂತ್ರಿ ಮಂದಾನಿಳಂ; ಚಂದ್ರಪ್ರಪು, ೧೧. ೫೯)"
ಧನಂಜಯ,"ಅರ್ಜುನ (ಅನ್ನೆಗಂ ತನ್ನ ಮಯ್ದುನನಪ್ಪ ಅಮೋಘಾಸ್ತ್ರಧನಂಜಯನ ಬರವಿನ ಸಂತಸದೊಸಗೆ ಪಡೆಮಾತಂ ಮುಂದುವರಿದಱಪುವಂತೆ: ಪಂಪಭಾ, ೪. ೩೨ ವ); ಅಗ್ನಿ (ಕೆಂಜೆಡೆ ಬಾಂದೊಱೆಯಿಂದೆ ಧನಂಜಯಂ ಅಹಿಪಂ ವಿಷಂ ವಿಭೂತಿ ಕಪಾಲಂ .. .. ರಂಜಿಸಲ್ ಅಭವಂ ಸ್ವರೂಪದಿಂದೆಸೆದಂ: ತ್ರಿಷಷ್ಟಿಪು, ೫೩. ೧೪); ಬೆಂಕಿ (ಯಾಮಿನೀವ್ಯೋಮದಂತೆ ಸಿತರುಚಿದಾಳ್ದು ಧನಂಜಯನಂತೆ ರುದ್ರಾಕ್ಷದಿಂ ರಂಜಿಸಿ: ರಾಜಶೇವಿ, ೧೦. ೫೭ ವ)"
ಧನಂಜಯಾಂಬಕ,"ಉರಿಗಣ್ಣ, ಶಿವ (ಪಾಂಡುಪುತ್ರನಾತಂ ಜಡಿದೊತ್ತೆ ಜಾಱ ಪೆಱಸಾರ್ವನೆ ಧೀರ ಧನಂಜಯಾಂಬಕಂ: ಶಬರಶಂ, ೪. ೪೪)"
ಧನದ,"ಕುಬೇರ (ಧನದಂ ಕಾಂಚನಪಂಚರತ್ನಮಯಂ ರಯವಷ್ಟಿಯಂ ಮಡುವಲ್ಲಿ: ಆದಿಪು, ೭. ೨೪); ಹಣ ನೀಡುವವನು (ಧನದರಲ್ಲದ ಧನದರಿಲ್ಲ ತಕ್ಕರಲ್ಲದೆ ಟಕ್ಕರಿಲ್ಲ ಜನ್ನಮಲ್ಲದೆ ಬನ್ನಮಿಲ್ಲ: ಅಜಿತಪು, ೧. ೨೦ ವ)"
ಧನದನಿವಾಸ,"ಕುಬೇರನ ಆವಾಸ, ಶ್ರೀಮಂತನ ಮನೆ (ಧನದನಿವಾಸದಿಂ ಮಣಿಮಯೋಜ್ವಳದೇವಕುಲಳಗಳಿಂದೆ ನಂದನವನದಿಂ: ಪಾರ್ಶ್ವನಾಪು, ೧. ೧೧೧)"
ಧನದಪತಿ,"ಕುಬೇರ (ಅದಱ ವಿಶಾಳತೆವೆತ್ತಿರ್ಪ ತತ್ಪ್ರಥಮಶಾಳದೊಳಗ್ರ ಸುರಪತಿ ಪಿತೃಪತಿ ಶರಧಿಪತಿ ಧನದಪತಿಗಳ ಕೇಳೀವಿಲಾಸಶೋಭಿತಂಗಳಪ್ಪ ನಾಲ್ಕುಂ ದೆಸೆಗಳ ಮಣಿರತ್ನಹರ್ಮ್ಯಂಗಳುಮಂ: ಶಾಂತೀಶ್ವಪು, ೧೬. ೩೧ ವ)"
ಧನದಮಿತ್ರ,"ಕುಬೇರನ ಸ್ನೇಹಿತ, ಶಿವ (ಕಲ್ಯಾಣಭೂಭೃತ್ ಸದನ ಧನದಮಿತ್ರಂ .. .. ನಂದಿಕೇಶಂ ಮಹೇಶಂ: ರಾಜಶೇವಿ, ೧. ೧ )"
ಧನದಾದ್ರಿ,"ಕುಬೇರನು ವಾಸಿಸುವ ಬೆಟ್ಟ, ಕೈಲಾಸಪರ್ವತ (ಧನದಾದ್ರಿಯೊಳ್ ಸುಖಂ ವಸಿಯಿಸುವಂತೆ ಅನಂತವನಿಪನಾ ಮಾಡದೊಳ್ ಉದ್ಭವಾಂಬುನಿಧಿ ವಿಶ್ವಸೇನನುದಿನಮಿರ್ಕುಂ: ಶಾಂತಿಪು, ೯. ೧೪೯)"
ಧನದಾನುಚರ,"ಕುಬೇರನ ಹಿಂಬಾಲಕ (ಅಱುವತ್ತುಕೋಟಿ ಧನದಾನುಚರರಂ ಅತಿರೌದ್ರಭಯಾನಕಮಾಗೆ ಕೊಂದು ಸೌಗಂಧಿಕ ಕಾಂಚನಕಮಳಹರಣಪರಿಣತನಾದಂ: ಪಂಪಭಾ, ೮. ೩೧)"
ಧನಶೌಂಡ,"ಹಣದ ಅಮಲಿನವನು ಧನಿಕ (ಜಗಲಿಸುತ್ತುಮಿರ್ದ ಕಾಂಚನರತ್ನ ಸಂಚಯಮಂ ಕಂಡು ಕೊಂಡು ಶೌಂಡಿಕಂ ಧನಶೌಂಡನಾಗಿ ಪೋದಂ: ನೇಮಿನಾಪು, ೪. ೧೧೪ ವ)"
ಧನಸಂಕುಲ,"ಸಂಪತ್ತೆಲ್ಲ (ಧರ್ಮಪುತ್ರನುಂ ಕುಲಧನಸಂಕುಲಗಳನೆ ತಂದಿಡೆ ಇಟ್ಟು ಅವನಾಡಿ ಸೋಲ್ತಂ ಆಕುಲಮತಿ ಮುಂದೆ ಭಾರತದೊಳೊಡ್ಡುವುದಂ ಕಡುನನ್ನಿ ಮಾೞ್ಪವೊಲ್: ಪಂಪಭಾ, ೬. ೭೨)"
ಧನು,"[ಜೈನ] ಬಿಲ್ಲು, ಎತ್ತರದ ಒಂದು ಅಳತೆ (ಏೞೆ ಧನು ಮೂಱು ಮೊೞನಿಂ ಪೇೞೆ ಷಡಂಗುಲಮೆ ಮೊದಲ ನಾರಕರ ಒಡಲ್: ಆದಿಪು, ೫. ೯೨)"
ಧನುರಾಗಮ,"ಬಿಲ್ವಿದ್ಯೆ, ಅಸ್ತ್ರಶಾಸ್ತ್ರ (ಆ ಗಗನೇಚರನುಂ ಧನುರಾಗಮವಿದ್ಯಾಗಮೈಕನಿಧಿ ವಿದ್ಯೆಗಳಿಂ ಪೋಗದೆ ಕಾದುತ್ತಿರೆ: ಶಾಂತಿಪು, ೪. ೨೫)"
ಧನುರ್ಗುಣ,"ಬಿಲ್ಲಿನ ಹೆದೆ (ಚಂಡ ಧನುರ್ಗುಣಮಂ ನೀವಿ ಜೇವೊಡೆಯಲೊಡನೆ: ಶಬಶಂವಿ, ೪. ೧೭ ವ) ಧನುರ್ಗುಣಕಿಣೀಕೃತೋದ್ಯತ್ಪ್ರಕೋಷ್ಠ[ಧನುರ್ಗುಣ+ಕಿಣೀಕೃತ+ಉದ್ಯತ್+ಪ್ರಕೋಷ್ಠ] ಬಿಲ್ಲಿನ ಹೆದೆಯಿಂದ ಜಿಡ್ಡುಗಟ್ಟಿರುವ ಮುಂಗೈಯುಳ್ಳವನು (ಪ್ರಣತಾರಾತಿ ಧನರ್ಗುಣಕಿಣೀಕೃತೋದ್ಯತ್ಪ್ರಕೋಷ್ಠಂ ಅನುಪಮಧೈರ್ಯಂರಣಕೇಲೀಲೋಲಂ .. .. ಎನೆ ನೆಗೞ್ದ ನೃಪಂ: ಪಂಚತಂತ್ರ, ೩೦೫ ಮತ್ತು ೩೦೬)"
ಧನುರ್ಗುಣಕ್ವಣಿತ,"ಬಿಲ್ಲಿನ ಹೆದೆಮಿಡಿತದ ಧ್ವನಿ (ಯುದ್ಧಸನ್ನದ್ಧರಾಗಿ ಧನುರ್ಗುಣಕ್ವಣಿತಕರಣ ಪ್ರಣಯಪಾಣಿಯಪ್ಪ ಮಂತ್ರಿಪುತ್ರಂಬೆರಸು .. .. ನಡೆಯೆ: ಲೀಲಾವತಿ, ೬. ೫ ವ)"
ಧನುರ್ಗುಣಲತಾನಿನಾದ,"ಬಿಲ್ಲಿನ ಬಳ್ಳಿಯಂತಿರುವ ಹಗ್ಗದ ಠೇಂಕಾರ (ಮನಂಪೆರ್ಚಿ ಧನುರ್ಲತಾಗುಣನಿನಾದಮನಾಲಿಸಿ ಕೇಳಲುಂ: ಪಂಪಭಾ, ೧. ೧೪೨)"
ಧನುರ್ದಂಡ,"ಧನುಸ್ಸು, ಬಿಲ್ಲು (ಆತೋದ್ಯಪ್ರಗೀತಧ್ವನಿಗಳಿರೆ ಧನುರ್ದಂಡಟಂಕಾರಮಂ ಕೇಳಲುಂ: ಆದಿಪು, ೮. ೩೩)"
page,2
ಧನುರ್ಧರ,"ಬಿಲ್ಲನ್ನು ಹಿಡಿದವನು (ಪಿಡಿಕೆಯ್ ತೀವಿದ ಕೂರ್ಗಣೆ ಮಡಕಾಲ್ವರಂ ಅಲೆವ ಕಚ್ಚೆ ನಿಡಿಯಸಿಯ ಒಱೆ ಕರ್ಪಿಡಿದ ಪಣೆಕಟ್ಟು ಕೆಯ್ಪಡೆ ಬೆಡಂಗನೊಳಕೊಳೆ ಧನುರ್ಧರರ್ ಪೆಣೆದೆಚ್ಚರ್: ಪಂಪಭಾ, ೧೦. ೭೧)"
ಧನುರ್ಧರಬಲ,"ಬಿಲ್ಗಾರರ ಸೈನ್ಯ (ಕಾೞ್ತುಱು ಮಸಗಿದಂತೆ ಮಸಗಿದ ದುರ್ಧರ ಧನುರ್ಧರಬಲಮುಮಂ ಶ್ವೇತ ಭೀಷ್ಮರ ಪೇೞ್ದ ಓಜೆಯೊಳೆರಡುಂ ಪಡೆಗಳ ಪಡೆವಳರ್ಕಳ್ ಕುರುಕ್ಷೇತ್ರದೊಳ್ ಚಿತ್ರಿಸಿದಂತೆ ಒಡ್ಡಿ ನಿಂದಾಗಳ್: ಪಂಪಭಾ, ೧೦. ೫೧ ವ)"
ಧನುರ್ಧರಾಗ್ರಗಣ್ಯ,"ಶ್ರೇಷ್ಠ ಬಿಲ್ವಿದ್ಯೆಗಾರ (ಅಂತು ಧನುರ್ಧರಾಗ್ರಗಣ್ಯನಾಗಿರ್ದೊಂದು ದಿವಸಂ ತನ್ನ ತೊಡೆಯ ಮೇಲೆ ತಲೆಯನಿಟ್ಟು ಪರಶುರಾಮಂ ಮಱೆದೊಱಗಿದಾ ಪ್ರಸ್ತಾವದೊಳ್: ಪಂಪಭಾ, ೧. ೧೦೪ ವ)"
ಧನುರ್ವಂಶ,"ಆನೆಯ ಬಿಲ್ಲಂತೆ ಬಾಗಿದ ಬೆನ್ನುಮೂಳೆ (ಧನಿರ್ವಂಶನುಂ ವಿಪುಲೋಪಚಿತಾಂಸನುಂ : ಅಜಿತಪು, ೪. ೨೦ ವ)"
ಧನುರ್ವೇದ,"ಅಸ್ತ್ರಶಾಸ್ತ್ರ; ಒಂದು ಉಪವೇದ (ಧನುರ್ವೇದ ಹಸ್ತಿ ಅಶ್ವ ತಂತ್ರ ರತ್ನಪರೀಕ್ಷೆಗಳುಮಂ .. .. ಉಪದೇಶಂಗೆಯ್ದು: ಆದಿಪು, ೮. ೬೦ ವ), ನೋಡಿ ಉಪವೇದ"
ಧನೇಶ,"ಕುಬೇರ (ಪಲಬರ್ಧನಪರ್ ತಮ್ಮೊಳಲಕೆಯಲೊರ್ವಂ ಧನೇಶನೆಂದು ಏಳಿಸುತಂ: ತ್ರಿಷಷ್ಟಿಪು, ೭. ೨೫)"
ಧನ್ಯ,"ಸದ್ಗುಣಿ (ಅಶೇಷಶಾಸ್ತ್ರಪಾರಗಂ ಅತಿಧನ್ಯನೆಂದು ಪರಿಭಾವಿಸಿ ಬಂದೊಡೆ ಅವಜ್ಞೆಗೆಯ್ದು ನಾಯ್ವುಗದೆಡೆಯೆಲ್ಲಮಂ ಪುಗಿಸಿ: ಸುಕುಮಾಚ, ೨. ೬೩); ಅದೃಷ್ಟವಂತ (ಕ್ಷೇಮಂಕರತೀರ್ಥಂಕರನೃಪಕುಮಾರಂಗಂ ಧನ್ಯಂ ಕನಕಚಿತ್ತೆಗಂ ವಜ್ರಾಂಕಿತ ತಳವಿಳಸಿತಂ ಪವಿತ್ರಂ ಪುತ್ರಂ: ಶಾಂತಿಪು, ೭. ೧೧೫)"
ಧನ್ವಂತರಿ,"ದೇವವೈದ್ಯ (ಸುರವೈದ್ಯನಪ್ಪ ಧನ್ವಂತರಿ ತರಿಸುವನಿಲ್ಲಿ ತನಗೆ ದೊರಕದ ತಂತ್ರೋತ್ಕರಮಂ ಎನೆ: ಕುಸುಮಾಕಾ, ೨. ೧೦೫)"
ಧನ್ವಿ,"ಬಿಲ್ಲುಗಾರ (ನಗರಾಜನಂತೆ ಅಚಲಾಂಗನಾಗಿ ಧನ್ವಿಯಂತೆ ಲಕ್ಷ್ಯಕಾಗ್ರಚಿತ್ತನೆನಿಸಿ ಕಲ್ಯಾಣಗೃಹದಂತೆ ಶಿವಪ್ರಭಾವಮಂ ಪಡೆದು: ರಾಜಶೇವಿ, ೧೦. ೫೭ ವ)"
ಧಮ್ಮಿಲ್ಲ,"ತುರುಬು (ಮೊಗಮಂ ತಾವರೆ ಕಣ್ನನುತ್ಪಳದಳಂ ಧಮ್ಮಿಲ್ಲಮಂ ಸೋಗೆ .. .. ಪೋಲ್ತುವು: ಆದಿಪು, ೬. ೮೫)"
ಧರ,"ಬೆಟ್ಟ (ಸುರಸಭೆಯಂತೆ ವಜ್ರಿಲಸಿತಂ ಧರನಂತೆ ಉರುಬಾಣಸಂಭೃತಂ: ತ್ರಿಷಷ್ಟಿಪು, ೨೭. ೧೫)"
ಧರಣಿ,"ಭೂಮಿ (ಸ್ಥಿರೆ ಧರಣಿ ಧಾತ್ರಿ ಮೇದಿನಿ ಧರಿತ್ರಿ ಧರೆ ಅವನಿ ಪೃಥ್ವಿ ರಸೆ ವಸುಧೆ ವಸುಂಧರೆ ಕು ಮಹಿ ಜಗತಿ ವಿಶ್ವಂಭರೆ ಗೋ ಕ್ಷ್ಮಾ ಕ್ಷೆಣಿ ಭುಮಿ ಭೂ ಗೋತ್ರೆ ನೆಲಂ: ಅಭಿಧಾವ, ೧. ೫. ೧)"
ಧರಣಿಜೆ,"ಭೂಮಿಯ ಮಗಳು, ಸೀತೆ (ಧರಣಿಜೆಯನುಯ್ದು ಲಂಕಾಪುರೇಶನಂತಪ್ಪ ಗಂಡರುಂ ಸತ್ತರ್ ನಿತ್ರಿಸದೆ: ಧರ್ಮಾಮೃ, ೪. ೧೪೧)"
ಧರಣಿಪತಿ,"ಭೂಮಿಯ ಒಡೆಯ, ರಾಜ (ಧರಣಿಪತಿಯಪ್ಪ ಚಕ್ರೇಶ್ವರನೊಳ್ ಧುರಧರೆಗೆ ವಂದು: ಕರ್ಣನೇಮಿ, ೧೧. ೯೭)"
ಧರಣಿಭೃತ್,"ಬೆಟ್ಟ (ಘನಕರ ಧರಣೀಭೃತ್ ನಿಭಸ್ಥೂಲಫೇನೋತ್ಕರಮುದ್ರಂ .. .. ಘುಳುಘುಳುಧ್ವಾನರುದ್ರಂ ಸಮುದ್ರಂ: ತ್ರಿಷಷ್ಟಿಪು, ೨. ೧೯)"
ಧರಣೀಂದ್ರ,"[ಜೈನ] ಪಾರ್ಶ್ವನಾಥ ತೀರ್ಥಂಕರನ ಯಕ್ಷ; ಭವನವಾಸಿ ದೇವನಾದ ನಾಗೇಂದ್ರ (ಧರಣೀಂದ್ರಂಗಂ ಅಳುಂಬಂ ಪೊಗೞಲ್ಕೆ ರೂಪು ನೀಳಾಂಜನೆಯಾ: ಆದಿಪು, ೯. ೧೭)"
ಧರಣೀಭೃತ್,"ರಾಜ (ಧರಣೀಭೃನ್ಮುನಿ ಪೊಱಗಾಗುೞದರ ಕಣ್ಮನಮೆಂಬಿವಂ ಉಗಿವುದು ಅಮರಗಣಿಕೆಯರಾಟಂ: ಶಾಂತಿಪು, ೧೧.೩೩)"
ಧರಣೀವಿಭಾಗ,"ಭೂಪ್ರದೇಶ (ಕರಿಯ ಮುಗಿಲ್ಗಳಿಂ ಗಗನಮಂಡಳಮೊಪ್ಪಿರೆ ಸೋಗೆಯಿಂ ವನಾಂತರಂ ಎಸೆದು ಒಪ್ಪೆ ತೋರ್ಪ ಮೊಳೆವುಲ್ಗಳಿನೀ ಧರಣೀವಿಭಾಗಂ ಒಪ್ಪಿರೆ: ಪಂಪಭಾ, ೭. ೨೩)"
ಧರಣೀಶ,"ಮಹಾರಾಜ (ನರರ ಐಶ್ವರ್ಯದ ಪೊದಳ್ಕೆಗಳ್ ಕರಗುವವೋಲ್ ಶರದಂಬುಧರಂ ಭೋಂಕೆನೆ ಕರಗಿದೊಡೆ ಎರ್ದೆ ಕರಗಿ ಕೊರಗಿದಂ ಧರಣೀಶಂ: ಆದಿಪು, ೪. ೬೪)"
ಧರಣೀಸುತ,"ಭಗದತ್ತ (ಧರಣೀಸುತನೞದಂ ದಿಕ್ಕರಿ ಕೆಡೆದುದು ನರಶರಂಗಳಿಂ: ಪಂಪಭಾ, ೧೧. ೮೨)"
page,3
ಧರಣೇಂದ್ರ,"[ಧರಣ+ಇಂದ್ರ] ನಾಗರಾಜ (ಅಂಬರಭೂಷಣ ಮಾಲಾಡಂಬರದ ಬೆಡಂಗನಮರನರ್ತಕಿ ಗಡಂ ಏನೆಂಬುದೊ ಧರಣೇಂದ್ರಂಗಂ ಅಳುಂಬಳಂ ಪೊಗೞಲ್ಕೆ ರೂಪು ನೀಳಾಂಜನೆಯಾ: ಆದಿಪು, ೯. ೧೭) [ಧರಣೇಂದ್ರ ಎಂಬುದು ನರಸಿಂಹಶಾಸ್ತ್ರಿಗಳು ಒಪ್ಪಿದ ರೂಪ]"
ಧರಾಚಕ್ರ,"ಭೂಮಂಡಲ (ಕುರುರಾಜಂ ವಿದ್ಯಾಧರಕರಣದೆ ನೆಗೆದು ಅಂಬರಕ್ಕೆ ಗದೆಯಂ ಕ್ರಮದಿಂ ತಿರುಪೆ ಧರಾಚಕ್ರಂ ಕೋವರಚಕ್ರಂ ತಿರಿವ ತೆಱದೆ ತಿರಿದತ್ತು ಎನಸುಂ: ಗದಾಯು, ೮. ೨೪)"
ಧರಾತಳ,"ಭೂತಳ (ಪಡೆದ ಧನಕ್ಕೆ ಲೆಕ್ಕಮಿಡಲ್ ಇಂದ್ರನಗಂ ಬಳಪಂ ಧರಾತಳಂ ಕಡಿತಂ ಅಹೀಶ್ವರಂ ತಗುಳೆ ಬಾಚಿಸುವೊಂ ಸುರಮಂತ್ರಿ ಕೂಡುವೊಂ: ಶಾಂತಿಪು, ೯. ೧೪೭)"
ಧರಾತಳನಿಷ್ಠಲಲಾಟಪಟ್ಟ,"ಭೂಮಿಗೆ ತಾಕಿದ ಹಣೆಯ ಪ್ರದೇಶವುಳ್ಳವನು, ಸಾಷ್ಟಾಂಗವೆರಗಿದವನು (ನಿಜಾನುಜಸಹಿತಂ ಇದಿರ್ವಂದು ಧರಾತಳನಿಷ್ಠಲಲಾಟಪಟ್ಟಂ ಸಾಷ್ಟಾಂಗವೆಱಗಿ ಪೊಡಮಟ್ಟು: ಪಂಪಭಾ, ೭. ೫೯ ವ)"
ಧರಾಧರಧನ್ವ,"ಮೇರುವನ್ನು ಬಿಲ್ಲಾಗಿ ಪಡೆದವನು, ಶಿವ (ಧರಾಧರಧನ್ವ ಶಶಾಖಖಂಡಮಂಡನ: ರಾಜಶೇವಿ, ೧೦. ೫೯)"
ಧರಾಧರಧರ,"ಬೆಟ್ಟವನ್ನು ಎತ್ತಿದವನು, ಕೃಷ್ಣ (ಗಾಂಡಿವಧರಂ ಗಂಗಾಧರಂ ತುಂಗಶಕ್ತಿಧರಂ ವಜ್ರಧರಂ ಧರಾಧರಧರಂ ಶ್ರೀಕೀರ್ತಿವಿದ್ಯಾಧರಂ: ಪಂಚತಂತ್ರ, ೩೭)"
ಧರಾಧರಸುತ,"ರಾಜಪುತ್ರ (ಈತಂಗೀ ಧರೆಯೊಳ್ ಧರಾಧರಸುತರ್ ಪೇೞಾರ್ ಸಮಂಬರ್ಪ ವಿಖ್ಯಾತರ್: ಕರ್ಣನೇಮಿ, ೩. ೨೨)"
ಧರಾಧಾರ,"ರಾಜ; ಬೆಟ್ಟ (ಧನದಮಿತ್ರಂ ಧರಾಧಾರ ಧರ್ಮಂ ವೈಶದ್ಯದ್ಯೋತಿ.. .. ನಂದಿಕೇಶಂ: ರಾಜಶೇವಿ, ೧,. ೧)"
ಧರಾಧ್ರ,"ಪರ್ವತ (ಘನಧೈರ್ಯಗುಣಂ ಧರಾಧ್ರಮಂ ಕೋಪಮದು ಅಗ್ನಿಯಂ .. .. ಗೆಲ್ದು: ರಾಜಶೇವಿ, ೩. ೭)"
ಧರಾಭಾರ,"ರಾಜ್ಯಭಾರ (ನೀನೆ ಜೆಟ್ಟಿಗನೈ ಮುನ್ನಿನ ಒಱಂಟು ವೇಡ ಮಗನೇ ಕೈಕೊಳ್ ಧರಾಭಾರಮಂ: ಪಂಪಭಾ, ೧. ೮೧)"
ಧರಾಮರ,"ಭೂಸುರ (ತರ್ಕವ್ಯಾಕರಣ ಕಾವ್ಯ ನಾಟಕ ಭರತ ವಾತ್ಸ್ಯಾಯನ ಆದಿ ಅಶೇಷವಿದ್ಯಾಸಮುದ್ರತರಣ ಗುಣೈಕಪುಣ್ಯನುಂ ಧರಾಮರಾಗ್ರಗಣ್ಯನುಂ ಆಗಿ: ಪಂಚತಂತ್ರ, ೪೧ ವ)"
ಧರಾಯುವತೀಶ,"[ಧರಾಯುವತಿ+ಈಶ] ಭೂಮಿ ಎಂಬ ಹೆಣ್ಣಿನ ಒಡೆಯ (ಅವಿಕಳನಿಯಮಶ್ರೀಯನಳವಡಿಸಿ ನಿಂದ ಧರಾಯುವತೀಶನಂ ಉದಾತ್ತನಾರಾಯಣನಂ ಕಂಡು: ಪಂಪಭಾ, ೮. ೧)"
ಧರಾಲಲನಾಧೀಶ,"ಭೂಮಿ ಎಂಬ ಹೆಣ್ಣಿನ ಒಡೆಯ, ರಾಜ (ಭೂತಲಪತಿ ಬೞಯಟ್ಟಿ ಬರಿಸೆ ಪೆಱತೊಂದೆಡೆಯೊಳ್ ಮಲರಹಿತರ್ ಬಂದು ಧರಾಲಲನಾಧೀಶಂಗೆ ವಿನತಮಸ್ತಕರಾದರ್: ಆದಿಪು, ೧೫. ೧೦)"
ಧರಾವಿಭಾಗ,"ಭೂಭಾಗ (ಪನ್ನಗಕೇತಂಗೆ ಧರಾವಿಭಾಗಮನಿತ್ತು ಸಂಪನ್ನಯೋಗನಿಯೋಗದಿಂದಂ ಅರಣ್ಯದೊಳ್ ನೆಲೆಸಿರ್ದು: ಪಂಪಭಾ, ೯. ೧೭)"
ಧರಿತ್ರಿ,"ಭೂಮಿ (ಕವಿದುವು ಕಾಳ ನೀಳ ಜಳದಾವಳಿ ವಾರಿಧಿಗಳ್ ಧರಿತ್ರಿಯಂ ಕವಿದುವು ಗಾಳಿಗಳ್ ಪ್ರಳಯಕಾಲಮನಾಗಿಸಲೆಂದೆ ಲೋಕಮಂ ಕವಿದುವು: ಪಂಪಭಾ, ೨. ೭೭)"
ಧರಿತ್ರೀಧರಸಾನು,"ಬೆಟ್ಟದ ತಪ್ಪಲು (ನೀನೀ ಧರಿತ್ರೀಧರಸಾನುಸ್ಥಾನದಿಂ ಪೋಗದೆ ಬೆಱತಿರೆ ನಿನ್ನಂ ಸಮಂತೆನ್ನ ಬಾಹಾಪರಿಘಾತಕ್ಕೆ ಪಕ್ಕಾಗಿಸಿ .. .. ಜಠರಶಿಖಾಜ್ವಾಲಿಕಾಮಾಲೆಗೀವೆಂ: ಶಾಂತೀಶ್ವಪು, ೯. ೧೪೧)"
ಧರಿತ್ರೀನಾಥ,"ಧರಾಧೀಶ (ಕುಸುಮದತ್ತಂಗೆ ಧರಿತ್ರೀನಾಥ ಪದವಿಯಂ ಕೊಟ್ಟಾ ನರಪತಿ ಬೞಕೆ ದೀಕ್ಷೆಯಂ ಕೈಕೊಂಡಂ: ಯಶೋಧಚ, ೪. ೭೬)"
ಧರೆ,"ಭೂಮಿ (ಏಂ ಗಾವಿಲನಯೊ ನಿನ್ನಂ ನುಂಗುವುದರ್ಕೆ ಇವರಂ ಎತ್ತವೇೞ್ಕುಮೇ ನೆರಮಂ ಸಂಗಳಿಸಲ್ವೇೞ್ಕುಮೇ ಮಾತಂಗವಿರೋಧಿಗೆ ಕುರಂಗಸಂಗರ ಧರೆಯೊಳ್: ಪಂಪಭಾ, ೩. ೧೭); ನೆಲ (ಆ ಕಮಳಾಕರಮಂ ಪೊಕ್ಕು ಆಕಾಶಧ್ವನಿಯಂ ಉಱದೆ ಕುಡಿದು ಅರಿಭೂಪಾನೀಕ ಭಯಂಕರನುಂ ಗಡಂ ಏಕೆಂದಱಯೆಂ ಬೞಲ್ದು ಜೋಲ್ದಂ ಧರೆಯೊಳ್: ಪಂಪಭಾ, ೮. ೪೧)"
ಧರೆಗಿಳಿ,"ಭೂಮಿಗೆ ಅವತರಿಸು (ಸುರನದಿಯ ನೀರೊಳ್ ಮಿಂದು ಇನನಂ ನೋಡಿ ನಿನ್ನ ದೊರೆಯನೆ ಮಗನಕ್ಕೆ ಎಂದಾಹ್ವಾನಂಗೆಯ್ಯಲೊಡಂ ದಲ್ ಧರೆಗಿೞದನಂದು ದಶಶತಕಿರಣಂ: ಪಂಪಭಾ, ೧. ೯೧)"
ಧರ್ಮ,"ವೈಯಕ್ತಿಕ ಬದುಕಿನ ಸಾರ್ಥಕ್ಯದ ನೆಲೆ (ನೆಗೞ್ದ ಆದಿಪುರಾಣದೊಳ್ ಅಱವುದು ಕಾವ್ಯಧರ್ಮಮಂ ಧರ್ಮಮುಮಂ: ಆದಿಪು, ೧. ೩೮); ನಂಬಿಕೆ ಆಚರಣೆಗಳ ಕಟ್ಟಳೆ (ಈ ಸಂಸೃತಿಯೊಳ್ ಧರ್ಮಾಧರ್ಮಸ್ಥಿತಿಯೆ ವಲಂ ಸ್ವರ್ಗನರಕಸುಖದುಃಖಕರಂ: ಆದಿಪು, ೭. ೭೭); ಯಮ (ಪುಟ್ಟುವುದುಂ ಧರ್ಮಮೊಡವುಟ್ಟಿದುದು ಈತನೊಳೆ ಧರ್ಮನಂಶದೊಳ್ ಈತಂ ಪುಟ್ಟಿದನೆಂದಾ ಶಿಶುಗೊಸೆದಿಟ್ಟುದು ಮುನಿಸಮಿತಿ ಧರ್ಮಸುತನೆನೆ ಪೆಸರಂ: ಪಂಪಭಾ, ೧. ೧೨೨); ಕರುಣೆ, ಕೃಪೆ (ನಿಮ್ಮಯ ಧರ್ಮದ ಮಕ್ಕಳೆವು ಎಮ್ಮಂ ಕಡೆಗಣಿಸಿ ನಿಮಗೆ ನೆಗೞ್ವುದು ದೊರೆಯೇ: ಪಂಪಭಾ, ೧೧. ೧೨೮); ಪುಣ್ಯ (ಪುಣ್ಯ ದಯಂ ಶ್ರೇಯಂ ವೃಷಂ ಸುಕರ್ಮಂ ಧರ್ಮಂ: ಅಭಿಧಾವ, ೧. ೩. ೧೩) ಧಾರ್ಮಿಕ ಕರ್ತವ್ಯ (ಧರ್ಮಮೆಂಬುದು ದಾನ ಪೂಜೆ ಶೀಲಂ ಉಪವಾಸಂದು ನಾಲ್ಕುಂ ತೆಱಂ: ಹರಿವಂಶ, ೧೦. ೧೦ ವ); ಬಿಲ್ಲು (ಧನದಮಿತ್ರಂ ಧರಾಧಾರ ಧರ್ಮಂ ವೈಶದ್ಯದ್ಯೋತಿ .. .. ನಂದಿಕೇಶಂ: ರಾಜಶೇವಿ, ೧,. ೧); ಯಮ (ಯಮಂ ಅರ್ಕಸುತಂ ಧರ್ಮಂ ಯಮುನಾಹಜಂ ಪರೇತವಿಭು ದಂಡಧರಂ ಶಮನಂ ಪಿತೃಪತಿ ಕಾಲಂ ಸಮವರ್ತಿ ಕೃತಾಂತಂ ಅಂತಕಂ ಕೀನಾಶಂ: ಅಭಿಧಾವ, ೧. ೧. ೪೧); ಗುಣಸ್ವಭಾವ (ಧರ್ಮಂ ಗುಣಸ್ವಭಾವವಾಚಿ ಅಭಿಧಾವ, ೩. ೧. ೭೧); [ಜೈನ] ದ್ವಾದಶಾನುಪ್ರೇಕ್ಷೆಗಳಲ್ಲಿ ಒಂದು, ಧರ್ಮಚಿಂತನೆ; ಧನುಸ್ಸು (ಮುನಿನಾಥಂ ದಶಧರ್‍ಮಧಾರಿ ದೃಢ ಷಟ್ಟ್ತ್ರಿಂಶಸದ್ಗುಣಂ ದಿವ್ಯ ಬಾಣ ನಿಧಾನಂ: ಪಂಪರಾ, ೧. ೨೦)"
page,4
ಧರ್ಮಕಥನ,"ಧರ್ಮಬೋಧನೆ ಮಾಡುವುದು (ಮುನಿಪತಿ ವಾಚನೆಯಿಂ ಪೃಚ್ಛನೆಯಿಂ ಅನುಪ್ರೇಕ್ಷೆಯಿಂ ತದಾಮ್ನಾಯದಿಂ ಒಯ್ಯನೆ ಧರ್ಮಕಥನದಿಂದಂ ವಿನುತಸ್ವಾಧ್ಯಾಯಮೆಂಬ ತಪಮಮಂ ತಳೆದಂ: ಸುಕುಮಾಚ, ೪. ೧೮)"
ಧರ್ಮಕಥಾವಸ್ತು,"[ಜೈನ] ಧರ್ಮದ ಬಗೆಗಿನ ಕತೆಗಳಲ್ಲಿನ ನಾಲ್ಕು ವಸ್ತುಗಳು (ಧರ್ಮಕಥಾವಸ್ತುವೆಂಬ ಅರ್ಥಕಥೆಯೆಂದುಂ ಕಾಮಕಥೆಯೆಂದುಂ ಧರ್ಮಕಥೆಯೆಂದುಂ ವ್ಯಾಮಿಶ್ರಮಕಥೆಯೆಂದುಂ ಚತುರ್ವಿಧಮಕ್ಕುಂ: ಚಾವುಂಪು, ಪು. ೪೩೯. ಸಾ. ೧೩. ೧೪)"
ಧರ್ಮಕಥೆ,"[ಜೈನ] ಇದರಲ್ಲಿ ಆಕ್ಷೇಪಣಿ, ವಿಕ್ಷೇಪಣಿ, ಸಂವೇದನಿ, ನಿರ್ವೇದನಿ ಎಂದು ನಾಲ್ಕು ಬಗೆ (ಧರ್ಮಕಥೆಯೆಂದು ಆಕ್ಷೇಪಣೀಯಂ ವಿಕ್ಷೇಪಣೀಯಂ ಸಂವೇದನೀಯಂ ನಿರ್ವೇದನೀಯಂ ಎಂದು ಚತುರ್ವಿಧಮಕ್ಕುಂ: ಚಾವುಂಪು, ಪು. ೪೩೯, ಸಾ. ೧೯೨೦)"
ಧರ್ಮಗಳ್,"[ಧರ್ಮ+ಕಳ್] ಪುಕ್ಕಟೆ ಕೊಡುವ ಕಳ್ಳು, ಹೆಂಡ (ನೆರೆದೆಲ್ಲರ್ ಕಳ್ಗುಡಿಯುತ್ತಿರೆ ಬಡವರ್ಗಲ್ಲಿ ಧರ್ಮಗಳ್ಳೆಂದು ಎಱೆವರ್ ಧರೆಯೊಳಗದುವುಂ ಧರ್ಮಮೆ: ಧರ್ಮಾಮೃ, ೧. ೧೩೯)"
ಧರ್ಮಗೇಹ,"ಧರ್ಮಕ್ಕೆ ಮನೆಯಂತಿರುವುದು, ನಂದಿ (ನಿಜವಾಹಂ ಧರ್ಮಗೇಹಂ ನಿಜಧನು ದನುಜಾರಾತಿಜಾತಾಧಿವಾಸಂ: ರಾಜಶೇವಿ, ೧. ೨)"
ಧರ್ಮಚಕ್ರ,"ಧರ್ಮದ ರಾಜ್ಯ (ಧರ್‍ಮಚಕ್ರ ಪರಚಕ್ರಮನಾಕ್ರಮಿಸಲ್ಕೆ ಸಾಲ್ವ ಭಾಸುರತರತೀವ್ರತೇಜದಪರಾಜಿತೆ ಮಾೞ್ಕೆ ಮತಿಪ್ರಕಾಶಮಂ: ಮಲ್ಲಿನಾಪು, ೧. ೯); ಧರ್ಮರಕ್ಷಣೆಗೆ ಚಕ್ರ ಹಿಡಿದವನು, ವಿಷ್ಣು; [ಜೈನ] ತೀರ್ಥಂಕರನು ವಿಹಾರ ಮಾಡುವ ಸಮಯದಲ್ಲಿ ಆತನ ಮುಂದೆ ಸಾಗುವ ಅತ್ಯಂತ ಪ್ರಕಾಶಮಾನವಾದ ಚಕ್ರ (ಜಿನಚಂದ್ರದೇವಂ ನಡೆಯೆ ಧರ್ಮಚಕ್ರಂ ಮುಂದೆ ನಡೆಯೆ: ಶಾಂತಿಪು, ೧೨. ೧೪ ವ)"
ಧರ್ಮಚಕ್ರವಾಳ,"[ಜೈನ] ಒಂದು ವ್ರತ (ನೋಂಪೆನೆಂದಡೆ ಉಡುಗದೆ ಸಲೆ ಧರ್ಮಚಕ್ರವಾಳಮನಾಗಳ್ ಬೇಡಿ: ಶಾಂತಿಪು, ೪. ೬೭ ಮತ್ತು ೬೭ ವ)"
