page,1
ಧರ್ಮಜ,"ಯಮನ ಮಗ, ಯುಧಿಷ್ಠಿರ (ಶ್ರೀದಿವ್ಯಕಾಂತಾಜನಂ ತೊಡವು ಎಂಬೊಂದುಮಂ ಆ ಸುರಾಸುರರಿಂ ಆ ಗೋವಿಂದನಿಂ ಮುನ್ನೆ ಕೋಳ್ಪಡೆದು ಅಂಭೋನಿಧಿಯಂತೆ ಬಂದು ನೆಗೞ್ದು ಇಂದ್ರಪ್ರಸ್ಥಮಂ ಧರ್ಮಜಂ: ಪಂಪಭಾ, ೪. ೯); ಪಾಂಡವ, ಬಿಳಿ ಹಕ್ಕಿ (ಧರ್ಮಜನ ಲಸತ್ತುರಗದ ಗಜಗಂಡದ ಭಾಸುರವಾದ್ಯದ ಪೆಸರ ಖಗಕುಳಂ ಕರಮೆಸೆಗುಂ: ರಾಜಶೇವಿ, ೫. ೬೦)"
ಧರ್ಮತನಯ,"ಧರ್ಮಜ (ಧವಳಹಯಂ ಧವಳರಥಂ ಧವಳ ಉಷ್ಣೀಷಂ ಶಶಾಂಕಸಂಕಾಶ ಯಶೋಧವಳಿತ ಭುವನಂ ತಾಗಿದಂ ಅವಯವದಿಂ ಬಂದು ಧರ್ಮತನಯನ ಬಲದೊಳ್: ಪಂಪಭಾ, ೧೧. ೩೯)"
ಧರ್ಮತನೂಜ,"[ಯಮ]ಧರ್ಮನ ಮಗ, ಯುಧಿಷ್ಠಿರ (ಧರ್ಮತನೂಜಂಗೆ ವಿರಾಟಂ ಅವನತಮಣಿಮಕುಟಂ ಇಂತೆಂದು ಬಿನ್ನಪಂಗೆಯ್ದಂ: ಪಂಪಭಾ, ೯. ೬ ವ)"
ಧರ್ಮದ್ವಿಷ,"ಧರ್ಮದ ವೈರಿ (ಮಳಿನಾತ್ಮಂ ಧರ್ಮದ್ವಿಷಂ .. .. ಎನಿಪ್ಪಾ ಕುದೃಷ್ಟಿಯಂ ಕಂಡು ಇನಿಸಂ ಮುಳಿಯಂ: ಸಮಯಪ, ೧೩. ೫೬)"
ಧರ್ಮಧ್ಯಾನ,"[ಜೈನ] ಧರ್ಮದ ವಿಷಯಗಳನ್ನು ಕುರಿತು ಸದಾ ಚಿಂತಿಸುವುದು; ಧ್ಯಾನಚತುಷ್ಟಯಗಳಲ್ಲಿ ಒಂದು, (ಆಜ್ಞಾವಿಚಯಂ ಅಪಾಯವಿಚಯ ವಿಪಾಕವಿಚಯ ಸಂಸ್ಥಾನವಿಚಯಮೆಂಬ ನಾಲ್ಕುಂ ಧರ್‍ಮಧ್ಯಾನಮಂ ಧ್ಯಾನಿಸುತ್ತುಂ: ಆದಿಪು, ೧೦. ೧೪ ವ); ನೋಡಿ, ಧ್ಯಾನಚತುಷ್ಟಯ"
ಧರ್ಮಪತ್ನಿ,"ಧಾರ್ಮಿಕವಾಗಿ ಮದುವೆಯಾದ ಹೆಂಡತಿ (ನಾಳಿನ ಬಾರಿಯೆಮ್ಮ ಮೇಲೆ ಬಂದುದೆಮ್ಮ ಮನೆಯೊಳ್ ಆನುಂ ಎಮ್ಮ ಧರ್ಮಪತ್ನಿಯುಂ ಮಗನುಂ ಮಗಳುಂ ಇಂತೀ ನಾಲ್ವರೆ ಮಾನಸರ್: ಪಂಪಭಾ, ೩. ೨೫ ವ)"
ಧರ್ಮಪಾನೀಯ,"ಹಾದಿಹೋಕರಿಗೆ ಉಚಿತವಾಗಿ ನೀಡುವ ನೀರು ಅಥವಾ ಪಾನೀಯ (ಪೂರ್ವಪದಾಂತ್ಯಕ್ಕೆ ದೀರ್ಘಮುಮುತ್ತರಪದದಾದಿಗೆ ಲೋಪಮುಮಾಗಿ ಧರ್ಮಪಾನೀಐಕ್ಕೆ ದಮ್ಮಾಣಿಯೆಂದಾಯ್ತು ಕಾಂಸ್ಯತಾಳಕ್ಕೆ ಕಂಸಾಳಮೆಂದಾಯ್ತು: ಶಬ್ದಮದ, ೩೦೮ ಪ್ರ)"
ಧರ್ಮಪುತ್ರ,"ಧರ್ಮನಂದನ (ಧರ್ಮಪುತ್ರನುಂ ಕುಲಧನಸಂಕುಲಗಳನೆ ತಂದಿಡೆ ಇಟ್ಟವಂ ಆಡಿ ಸೋಲ್ತಂ: ಪಂಪಭಾ, ೬. ೭೨)"
ಧರ್ಮಪೋತ,"ಧರ್ಮವೆಂಬ ಹಡಗು (ವಿಷಯಭೋಗಾಸವ ಅತ್ಯಂತಸೇವಾಮದದಿಂದಂ ಧರ್ಮಪೋತಚ್ಯುತರ್: ಆದಿಪು, ೯. ೫೮)"
ಧರ್ಮಪ್ರಭಾವನೆ,[ಜೈನ] ಸಮ್ಯಗ್ದರ್ಶನದ ಎಂಟು ಅಂಗಗಳಲ್ಲಿ ಕೊನೆಯದು; ಜೈನಧರ್ಮದ ಬಗ್ಗೆ ಇತರರಲ್ಲಿ ಪ್ರಚಾರ ಮಾಡುವುದು
ಧರ್ಮಭಂಡಾರ,"ದಾನಕಾರ್ಯಗಳಿಗೆ ಮೀಸಲಾದ ಕೋಶ (ಹರಿಗನ ಧರ್ಮಭಂಡಾರದಂತೆ ಸಾರಮಾದುದು ಬಿಟ್ಟಗ್ರಹಾರಂ ಆ ಸಬ್ಬಿಸಾಸಿರದೊಳಂ ಧರ್ಮವುರಂ: ಪಂಪಭಾ, ೧೪. ೫೬)"
ಧರ್ಮಶಾಸ್ತ್ರ,"ಮನು, ಬೃಹಸ್ಪತಿ, ದಕ್ಷ, ಗೌತಮ, ಯಮ, ಅಂಗೀರಸ, ಯೋಗೀಶ್ವರ, ಪ್ರಚೇತಾ, ಶಾತಾತಪ, ಪರಾಶರ, ಸಂವರ್ತ, ಉಶನಸ, ಶಂಖ, ಲಿಖಿತ, ಅತ್ರಿ, ವಿಷ್ಣು, ಆಪಸ್ತಂಬ, ಹಾರೀತ ಎಂಬುವವರ ಹದಿನೆಂಟು ಸ್ಮೃತಿಗಳು (ಪದಿನೆಂಟು ಧರ್ಮಶಾಸ್ತ್ರಂಗಳೊಳಂ, ನಾಲ್ಕುವೇದಂಗಳೊಳಂ ಆಱಂಗದೊಳಂ: ಪಂಪಭಾ, ೨. ೩೪ ವ)"
ಧರ್ಮಶ್ರವಣ,"ಧರ್ಮದ ಪ್ರವಚನ (ಪಱವಿಡಲಣಮೀಯದವರಂ ಅವರ್ಗಳ ಬಾೞೊಳ್ ನಿಱಸಲ್ ಬಗೆದೈ ಕರಮೆನೆ ಉಱದೆ ಇರ್ಕುಮೆ ನಿನ್ನ ಪೇೞ್ದ ಧರ್ಮಶ್ರವಣಂ: ಪಂಪಭಾ, ೯. ೪೫)"
page,5
ಧರ್ಮಸಂತತಿ,"ಧರ್ಮದ ಮುಂದುವರಿಕೆ (ಗೃಹಸ್ಥಧರ್ಮದಿಂದಂ ನೀನೆಂತಂತೆ ಸಲೆ ನೆಗೞೆ ಜಗತೀಸಂತತಿ ನಿಲೆ ನಿನ್ನ ಧರ್ಮಸಂತತಿ ನಿಲ್ಕುಂ: ಆದಿಪು, ೮. ೧೩)"
ಧರ್ಮಸುತ,"ಯುಧಿಷ್ಠಿರ (ಪುಟ್ಟುವುದುಂ ಧರ್ಮಂ ಒಡವುಟ್ಟಿದುದು ಈತನೊಳೆ ಧರ್ಮನಂಶದೊಳ್ ಈತಂ ಪುಟ್ಟಿದನೆಂದಾ ಶಿಶುಗೊಸೆದಿಟ್ಟುದು ಮುನಿಸಮಿತಿ ಧರ್ಮಸುತನೆನೆ ಪೆಸರಂ: ಪಂಪಭಾ, ೧. ೧೨೨)"
ಧರ್ಮಾತ್ಮಜ,"ಧರ್ಮರಾಯ, ಯುಧಿಷ್ಠಿರ (ಧರ್ಮಾತ್ಮಜಂ ಕೇಳ್ದು ಆ ಹರಿ ಪೇೞ್ದುದೊಂದು ನಯದಿಂದಾ ರಾತ್ರಿಯೊಳ್ ಪೋಗಿ ಕುಂಭಜನಂ ಕಂಡು: ಪಂಪಭಾ, ೧೧. ೧೨೬)"
ಧರ್ಮಾಧಿಕರಣ,"ನ್ಯಾಯನಿರ್ಣಾಯಕ ಮಂಡಲಿ, ನ್ಯಾಯಾಧಿಕಾರಿ (ಪುಯ್ಯಲಿಡುವ ಕರುಣಾರವಮಂ ತಳವಾಱಂ ಕೇಳ್ದು ಪರಿತಂದು ನಾವಿದನುಮಂ ಅವನ ಪೆಂಡತಿಯುಮಂ ಪಿಡಿದು ಒಡಗೊಂಡು ಪೋಗಿ ಧರ್ಮಾಧಿಕರಣದ ತಾಣಾಂತರದೊಳ್ ಇರಿಸಿದಂ: ಪಂಚತಂತ್ರ, ೧೩೭ ವ)"
ಧರ್ಮಾಧ್ಯಕ್ಷ,"ನ್ಯಾಯಾಧೀಶ (ವಿಷಯ ಗೃಹಾಮಾತ್ಯ ದಂಡಾಧಿನಾಥಾವಳಿ ಧರ್ಮಾದ್ಯಕ್ಷ ಕೋಶಾಧಿಪ ತಳವರ ಹಾಸ್ಯಾದಿ ತಂತ್ರಾಳಿಪಾಳಾವಳಿ ರಾಜಶ್ರೇಷ್ಠಿ ಸೇನಾಪರಿಕರಣ ಪುರೋಧೋಧಿಕಾರ ಅಂಗರಕ್ಷಾವಳಿ ಮುಖ್ಯಂಬೆತ್ತ ಬಾಹತ್ತರದೆಸಕದ ನಾನಾ ನಿಯೋಗಿಪ್ರತಾನಂ: ಶಾಂತೀಶ್ವಪು, ೧೫. ೯೦)"
ಧರ್ಮಾಸ್ತಿಕಾಯ,"[ಜೈನ] ಪಂಚಾಸ್ತಿಕಾಯಗಳಲ್ಲಿ ಒಂದು; ಬಹುಪ್ರದೇಶದಲ್ಲಿ ವ್ಯಾಪಿಸಿರುವ ಧರ್ಮದ್ರವ್ಯ (ನವಪದಾರ್ಥಂಗಳುಂ ಪಂಚಾಸ್ತಿಕಾಯ ಷಡ್ದ್ರವ್ಯಂಗಳುಂ ಎಂಬಿವಱೊಳ್ ಆದಮಾನುಂ ಅಱತಮುಂ ಕುಶಲಿಕೆಯುಂ ನಂಬುಗೆಯುಂ ಆಗಿ: ವಡ್ಡಾರಾ, ಪು ೬, ಸಾ ೧೯), ನೋಡಿ, ಪಂಚಾಸ್ತಿಕಾಯ"
ಧವಳ,"ಬಿಳಿಯ (ಧವಳಹಯಂ ಧವಳರಥಂ ಧವಳ ಉಷ್ಣೀಷಂ ಶಶಾಂಕಸಂಕಾಶ ಯಶೋಧವಳಿತ ಭುವನಂ ತಾಗಿದಂ ಅವಯವದಿಂ ಬಂದು ಧರ್ಮತನಯನ ಬಲದೊಳ್: ಪಂಪಭಾ, ೧೧. ೩೯); ಒಂದು ಬಗೆಯ ಗಾನ, ಆಶೀರ್ವಚನ (ಕೀರ್ತಿಯಿಂಧವಳಮಂಗಳಗೇಯದಿನೊಪ್ಪೆ ಬರ್ಪ ಕೌರವಧವಳಂಗೆ ದೇಸಿಗನೆ ಬರ್ಪವೊಲೊರ್ವನೆ ಬರ್ಪುದಾದುದೇ: ಗದಾಯು, ೫. ೪೧)"
ಧವಳಚ್ಛತ್ರ,"ಬೆಳ್ಗೊಡೆ (ಉನ್ನತ ಧವಳಚ್ಛತ್ರಚ್ಛನ್ನ ವಿಯತ್ತಳನಂ ಇಂದುಕುಳತಿಳಕನಂ ಇಂತು ಅನ್ನೆಯದಿಂದ ಈ ಪೞುವಿನೊಳ್ ಎನ್ನರಸನಂ ಇಂತು ಬಿದಿಯೆ ತಂದಿಕ್ಕುವುದೇ: ಪಂಪಭಾ, ೨. ೨೨)"
ಧವಳಚ್ಛತ್ರಚ್ಛನ್ನ,"[ಧವಳಚ್ಛತ್ರತ್+ಛನ್ನ] ಬೆಳ್ಗೊಡೆಯಿಂದ ಮುಚ್ಚಿದ (ಉನ್ನತ ಧವಳಚ್ಛತ್ರಚ್ಛನ್ನ ವಿಯತ್ತಳನಂ ಇಂದುಕುಳತಿಳಕನಂ ಇಂತು ಅನ್ನೆಯದಿಂದ ಈ ಪೞುವಿನೊಳ್ ಎನ್ನರಸನಂ ಇಂತು ಬಿದಿಯೆ ತಂದಿಕ್ಕುವುದೇ: ಪಂಪಭಾ, ೨. ೨೨)"
ಧವಳದ್ಯುತಿ,"ಹೊಳೆಯುವ ಕಾಂತಿ (ಧವಳದ್ಯುತಿಯಂ ತವೆ ಪಸರಿಪ ದಿವ್ಯ ದುಕೂಲವನುಡಿಸಿದರ್ ಅಗತನೂಜೆಗೆ ಅಂಗನೆಯರ್ಕಳ್: ಗಿರಿಜಾಕ, ೧೦. ೩೧)"
ಧವಳಯಶಂ,"ನಿರ್ಮಲ ಕೀರ್ತಿಯುಳ್ಳವನು (ನರಸಿಂಗಂಗತಿ ಧವಳಯಶಂ ಯುದ್ಧಮಲ್ಲನಗ್ರಸುತಂ ತದ್ಭುವನ ಪ್ರದೀಪನಾಗಿರ್ದವಾರ್ಯ ವೀರ್ಯಂಗೆ ಬದ್ದೆಗಂ ಪಿರಿಯ ಮಗಂ: ಪಂಪಭಾ, ೧. ೨೩)"
ಧವಳವಟ್ಟ,"ಬಿಳಿಯ ಬಟ್ಟೆ [ಸಾಹಿಯಾಣದ ಚೀನದ ಧವಳವಟ್ಟದ ಜೊಂಗದ ದೇವಾಂಗದ ಸಕಳವಟ್ಟೆಗಳುಮಂ: ಆದಿಪು, ೪. ೩೪ ವ)"
ಧವಳಾಕ್ಷತ,"ಬಿಳಿಯ ಅಕ್ಷತೆಕಾಳು (ಪರಸುವ ಪೌರವೃದ್ಧರ ಕುಲಾಂಗನೆಯರ್ಕಳ ಸಾಧುವಾದದೊಳ್ ಬೆರಸಿ ಸಮಂತು ಸೂಸುವ ಜಲಾರ್ದ್ರಲಸದ್ಧವಳಾಕ್ಷತಂಗಳೊಳ್: ಪಂಪಭಾ, ೨. ೯೫)"
ಧವಳಾಕ್ಷಿ,"ಬೆಳ್ಳಗೆ ಹೊಳೆಯುವ ಕಣ್ಣುಳ್ಳವಳು (ಕಣ್ಣಱಯದ ಬೆಳ್ಳಂ ಅಲ್ಲೆಂ ಅಱದೆಂ ಧವಳಾಕ್ಷಿಯ ನೋಟದಂದಮಂ: ಪಂಪಭಾ, ೪. ೭೬)"
ಧವಳಾಗಾರ,"ಬಿಳಿಯ ಮನೆ, ದೊಡ್ಡ ಸೌಧ (ಈ ಪೊೞಲೊಳ್ ಸುಪ್ರದೇಶಮಪ್ಪ ಸ್ಥಾನದೊಳ್ ಸುಧಾಧವಳಿತಮಪ್ಪ ಧವಳಾಗಾರಂ ಗೋಷ್ಠಾಗಾರಂ ಮೊದಲಾಗಿ ಪಲವುಂ ಶೋಭಾವಹಂಗಳಪ್ಪ ಗೃಹಂಗಳಂ ಮಾಡಿಸಿ: ಪಂಚತಂತ್ರ, ೨೫೪ ವ)"
ಧವಳಾತಪತ್ರ,"ಬೆಳ್ಗೊಡೆ (ರಜತಾದ್ರಿಯೆನೆ ನೃಪನಂದನ ಧವಳಾತಪತ್ರಂ ಎಸೆದತ್ತಾಗಳ್: ಕಾದಂಬ, ೩. ೧೧೪)"
ಧವಳಾತಪತ್ರೇಶ್ವರ,"ಬೆಳ್ಗೊಡೆಯ ಒಡೆಯ, ಮಹಾರಾಜ (ನಿಮಗೆ ಮಗನುಚಿತ ಧವಳಾತಪತ್ರೇಶ್ವರಂ ದಿವದಿನವತರಿಪಂ ಅಮಿತಪುಣ್ಯೋದಯಂ: ಆದಿಪು, ೭. ೨೭ ರಗಳೆ)"
ಧವಳಾತಪವಾರಣ,"ಬೆಳ್ಗೊಡೆ (ಧವಳಾತಪವಾರಣ ವಿಭೂತಿಯನುೞದು ನೆUೞ್ದುಪಾಸಕನಾದಂ: ಆದಿಪು, ೬. ೬)"
ಧವಳಿಸು,"ಬಿಳುಪಾಗಿಸು, ಪ್ರಕಾಶಿಸು (ಮಣಿಹಾರಮಾಲೆಯಂ ಧವಳಿಸಿ ನೀಳ್ದ ಬೆಳ್ವೆಳಗಿನಿಂ ಬಿರಿಯಲ್ ಸರಸೀರುಹಂಗಳ್: ಲೀಲಾವತಿ, ೧೦. ೯೦)"
ಧಾತಕೀ,"ಅರೆಹೂ, ಮರಾಟಿಮೊಗ್ಗು (ಪಿಷ್ಟೋದಕ ಧಾತಕೀ ಗುಡ ಸಮಯೋಗದಿಂದಂ ಎಂತು ಮದವಿಕಾರಮೆಸೆದಪ್ಪುದು ಅಂತೆ: ಆದಿಪು, ೨. ೯ ವ)"
page,6
ಧಾತಕೀಷಂಡ,"[ಜೈನ] ಪುಷ್ಕರದ್ವೀಪದ ಒಂದು ಭಾಗ; ಧಾತಕೀವೃಕ್ಷ ಹೇರಳ ವಾಗಿರುವ ಜಾಗ (ಧತಕೀಷಂಡಂ ಈಕ್ಷಣಭದ್ರಂ ಸಸಮುದ್ರಮಂ ಬಳಸಿ ಜಂಬೂದ್ವೀಪವಿನ್ಯಾಸಮಂ: ಚಂದ್ರಪ್ರಪು, ೧. ೭೨)"
ಧಾತು,"ಲೋಹ (ಸಧಾತು ಕುಭೃದ್ಯುಗಕ್ಕೆ ಸಿಂದೂರಿತಗಂಧಸಿಂಧುರಯುಗಕ್ಕೆ ಎಣೆಯೆಂಬಿನಂ ಅಣ್ಮಿ ಕಾದಿದರ್ ಕೌರವರಾಜನುಂ ಕುರುಕುಲಾಂತಕನುಂ: ಗದಾಯು, ೮. ೧೭); ರೇತಸ್ಸು, ವೀರ್ಯ (ಮಸೆವುದು ಮಾಸಲಿರ್ದ ಪೞವೇಟಮಂ ಇಚ್ಛೆಯ ಬಿಚ್ಚತಿಕ್ಕೆಯಂ ಪೊಸೆಯಿಪುದು ಒಳ್ಕಮಂ ನಡೆಪುತಿರ್ಪುದು ಧಾತುವಂ ಒಳ್ಳಿತೆಯ್ದೆ ಪಾಟಿಸುವುದು ಕೂಟದೊಳ್ ಕುಶಲನಪ್ಪುದು: ಶಾಂತಿಪು, ೮. ೯೧)"
ಧಾತುಮಳ,"[ಜೈನ] ಇಂದ್ರಿಯಗಳಿಂದ ಹುಟ್ಟುವ ಕೊಳೆ, ಬೆವರು ಮುಂತಾದವು (ಧಾತುಮಳದೋಷರಹಿತಂ ವೀತನಖ ಶ್ಮಶ್ರು ಕೇಶ ಲೋಮಂ ಶೋಭಾನ್ವೀತಪರಿಪೂರ್ಣಯೌವನಂ: ಆದಿಪು, ೬. ೩೮)"
ಧಾತೃಪುತ್ರ,"ಬ್ರಹ್ಮಪುತ್ರ, ನಾರದ (ಸರಸೀಜೋದರಂ ಆದರದಿಂದಂ ಧಾತೃಪುತ್ರನಂ ಬೆಸಗೊಂಡಂ: ಕರ್ಣನೇಮಿ, ೧೧. ೭೨)"
ಧಾತ್ರ,"ಬ್ರಹ್ಮ (ಏಂ ಜಾಣನೋ ಧಾತ್ರಂ ರೂಪನಿಷ್ಪಾದನವಿಧಿಯೊಳಿವಂ ಮುನ್ನಮೇಂ ನೋಂಪಿಯಂ ನೋಂತನೊ: ಅದಿಪು, ೩. ೯೧)"
ಧಾತ್ರಿ,"ಸಾಕುತಾಯಿ, ದಾದಿ (ಧಾತ್ರಿಯೊಳನ್ಯರ ತೇಜೋಮಾತ್ರಮನಾಂ ಸಲಿಸೆನೆಂಬ ತೆಱದಿಂ ಪೊಯ್ಯಲ್ ಧಾತ್ರಿಯ ಕಯ್ಯಿಂ ನಿಮಿರ್ವಂ ಕ್ಷತ್ರಶಿಖಾಮಣಿ ಮಣಿಪ್ರದೀಪಾಂಕುರಮಂ: ಪಂಪರಾ, ೩. ೧೨೫); ಭೂಮಿ (ರಥದಿಂ ಧಾತ್ರಿಗೆ ಪಾಯ್ದು ಕೊಂಡು ಗದೆಯಂ ಕೆಯ್ಸಾರ್ದುದು ಅಸ್ಮತ್ ಮನೋರಥಂ ಇಂದು ಎಂದು ಕಡಂಗಿ: ಪಂಪಭಾ, ೧೧. ೬೬); ನೆಲ್ಲಿ (ಧಾತ್ರೀತರು ಆಮಲಕ: ಅಭಿಧಾವ, ೧. ೮. ೧೨)"
ಧಾತ್ರಿಕಾ[ಕೆ],"ದಾದಿ (ಅನಂತರಂ ಅಮರ ಧಾತ್ರಿಕಾನಿಕಾಯಮುಮಂ .. .. ಜಗತ್ಪತಿ ಪಿತೃಗಳುಮಂ ಬೀೞ್ಕೊಂಡು: ಅರ್ಧನೇಮಿ, ೮. ೧೬೭ ವ)"
ಧಾತ್ರೀಜನ,"ದಾದಿಯರು (ಗುರುಜನ ಅಭಿಷಕ್‌ಜನ ಗಣಕಜನ ಗಣಿಕಾಜನ ಧಾತ್ರೀಜನ ಕುಲಮಹತ್ತರಿಕಾಜನಮನಂ ಸಮರ್ಪಿಸುವುದುಂ ಅನಂತರಂ: ಮಲ್ಲಿನಾಪು, ೪. ೬೨ ವ)"
ಧಾತ್ರೀಧರ,"ಪರ್ವತ (ಮಹಾಪ್ರಾಸಾದದಂತಿರ್ಪುದು ಆವಗಂ ಆಶ್ಚರ್ಯಮನಪ್ಪುಕೆಯ್ದು ವಿಜಯಾರ್ಧಖ್ಯಾತ ಧಾತ್ರೀಧರಂ: ಶಾಂತೀಶ್ವಪು, ೮. ೭)"
ಧಾತ್ರೀಫಳ,"ನೆಲ್ಲಿಕಾಯಿ (ಪೆಸರ್ವೆತ್ತ ಧಾತ್ರಿಯಂ ನೀರಸಮಂ ಮಾಡಿತ್ತು ಮತ್ತೆ ಧಾತ್ರೀಫಳಮಂ ರಸಮಯಮಂ ಮಾಡಿತು ಮಾಗಿ: ಶಾಂತೀಶ್ವಪು, ೧೨. ೭೫ ಎ)"
ಧಾತ್ರೀರಜ,"ಮಣ್ಣು, ದೂಳು (ಮುಸುಕಿತ್ತೀ ಜಗಮೆಲ್ಲಮಂ ಬಳಪದ ಪ್ರಕ್ಷುಣ್ಣ ಧಾತ್ರೀರಜಂ: ವರ್ಧಮಾಪು, ೪. ೩೮)"
ಧಾತ್ರೀರುಹ,"ಮರಗಿಡ ಮನದಿಂ ಬೇಗಂ ಮುಟ್ಟಿದಂ .. .. ಪವನನಂದನಂ ಅನಿಂದ್ಯಗುಣಂ ಎಸೆವ ಅಶೋಕಧಾತ್ರೀರುಹಮಂ: ಕಾವ್ಯಾವಲೋ, ೧೦೬)"
ಧಾನುಷ್ಕ,"ಶರಸಂಧಾನ (ಅವಿಚಾರಂ ವನದೊಳ್ ದ್ವಿಜಾಪಹರಣಂ ಧಾನುಷ್ಕದೊಳ್ ಭಂಗದುದ್ಭವಂ ಅಂಭೋನಿಧಿಯೊಳ್: ತ್ರಿಷಷ್ಟಿಪು, ೨. ೩೦)"
ಧಾನುಷ್ಕಬಳ,"ಬಿಲ್ಗಾರರ ಪಡೆ (ತತ್ ಕ್ಷಣದಿಂದ ಉಲ್ಬಣಮಾಗಿರೆ ಪೆಣಮಾಯ್ತು ಅರಿನೃಪಾಳ ಧಾನುಷ್ಕಬಳಂ: ಕರ್ಣನೇಮಿ, ೫. ೮೪)"
ಧಾನ್ಯಕ,"ಕೊತ್ತಂಬರಿ (ಕುಸುಂಭ ಕಾರ್ಪಾಸ ಸರ್ಷಪ ಜೀರಕ ಧಾನ್ಯಕಾದಿ ವಿವಿಧಧಾನ್ಯಭೇದಂಗಳುಂ: ಆದಿಪು, ೬. ೭೨ ವ); ಬತ್ತ (ಸ್ತಮಕಂ ಧಾನ್ಯಕಂ ವ್ರೀಹಿ: ಅಭಿಧಾವ, ೧. ೧೬. ೧೬)"
ಧಾನ್ಯಮಂಜರಿ,"ಕಾಳಿನ ತೆನೆ (ರಂಜಿಸುವ ಧಾನ್ಯಮಂಜರಿಯ ನೆೞಲ್ ಪೊಳೆಯೆ ತೆನೆವೋದುವು ಬೇರ್ಗಳೆನಿಪುವು ಬೆಳೆದ ತೆಱದೆ ಕೞವೆ ಭೂಸಾರತೆಯಿಂ: ಚಂದ್ರಪ್ರಪು, ೧. ೯೨)"
ಧಾನ್ಯಸಂಚಯ,"ದವಸದ ದಾಸ್ತಾನು (ಶಿರೋವ್ಯೂಢ ಧಾನ್ಯಸಂಚಯೋಪಭೋಗಿ ಜನ ನಿವಾಸಿಗಳಪ್ಪ ಸಂವಾಹಂಗಳುಮಂ: ಆದಿಪು, ೮. ೬೩ ವ)"
ಧಾನ್ಯಸಮಿತಿ,"ದವಸದ ರಾಶಿ (ಪುದಿದ ತಱಗೆಲೆಗಳಂ ಕಂಡುದಱಂದಂ ಧಾನ್ಯಸಮಿತಿ ನೀರಸಮಕ್ಕುಂ: ಆದಿಪು, ೧೫. ೪೬)"
ಧಾನ್ವನದುರ್ಗ,"ಮರುಭೂಮಿಯ ನಡುವಣ ದುರ್ಗ (ಧಾನ್ವನದುರ್ಗಕ್ಕೆ ಬೃಹಲ್ಲಯಾಗ್ನಿಯೆನೆ ತನ್ಮುದ್ಯತ್ಪ್ರತಾಪಾಗ್ನಿ ನೀೞ್ದೆನಸುಂ ಪರ್ವಿ ವಿಗುರ್ವಿಸಲ್: ಪುಷ್ಪದಂಪು, ೫. ೫೦)"
ಧಾಮ,"ಮನೆ (ಧಾಮಂ ನಿವಾಸ: ಅಭಿಧಾವ, ೩. ೧. ೧೩);"
page,7
ಧಾರಣ,"ಆಶ್ರಯದಾತ, ಪೋಷಕ (ಇಷ್ಟತುಷ್ಟಧಾರಣಂ ಅವದಾತಕೀರ್ತಿಗೃಹತೋರಣಂ ನರೇಂದ್ರಗಂಧವಾರಣಂ: ಗದಾಯು, ೧, ೧೭)"
ಧಾರಾ,"ಕತ್ತಿಯ ಅಲಗು (ಭೂಮಂಡಳಪತಿಯ ಖಡ್ಗ ಧಾರಾಜಳದೊಳ್ ಸಾಮ್ರಾಜ್ಯಲಕ್ಷ್ಮಿ ಸಲೆ ನೆಲಸಿರ್ದಳ್: ಕಾದಂಸಂ, ೧. ೭)"
ಧಾರಾಗೃಹ,"ತಂಪಾಗಿರಲು ನೀರು ಎರಚುವ ಏರ್ಪಾಟಿರುವ ಮನೆ (ಪಲವುಂ ಧರಾಗೃಹಂಗಳ್ ಅತನುವಿಕಾರಮಂ ಒದವಿಪುದು ದೇವದಂಪತಿಗದಱೊಳ್: ಆದಿಪು, ೬. ೯೫)"
ಧಾರಾಜಳಂ,"[ಮಳೆಯಂತೆ] ಸುರಿಯುವ ನೀರು (ಎಯ್ತಂದರಂ ತೊಱೆಕೊಳ್ವಂತಿರೆ ಕೊಂಡುವು ಅಂದು ಅರಿಗನೆಚ್ಚ ಉಗ್ರೇಷುಧಾರಾಜಳಂ: ಪಂಪಭಾ, ೫. ೨೧)"
ಧಾರಾಧರ,"ಮೋಡ (ಅದು ಧಾರಾಧರಂ ಅಬ್ದದಂತೆ ಪೊಳೆಯಂತೆ ಆವರ್ತಯುಕ್ತಂ .. .. ಶ್ರೀಕರಲಕ್ಷಣಾಂಕಂ ಎನಿಸಿತ್ತು ರಾಜವಾಜಿದ್ವಯಂ: ರಾಜಶೇವಿ, ೧೨. ೧೦೨)"
ಧಾರಾಪಂಚಕ,"ಕುದುರೆಯ ಐದು ಬಗೆಯ ನಡಿಗೆಗಳು: ಆಸ್ಕಂದಿತ, ಧೌರಿತಕ, ರೇಚಿತ, ವಲ್ಗಿತ, ಪ್ಲುತ (ವಾಜಿಯಂ ಧಾರಾಪಂಚಕದೊಳ್ ವಿಚಿತ್ರ ಲಯದಿಂ ತಾಮೇಱ ಬರ್ಪೀ ಮಹಾಧೀರರ್ ಕಾಲ್ನಡೆಯೊಳ್ ನೃಪಾವಸಥಧಿಂ ಬರ್ಪಂಧಂ ಆವಂದಮೋ: ಪಂಪರಾ, ೬. ೧೮೦)"
ಧಾರಾಸಾರ,"ಧಾರಾಕಾರವಾದ ಮಳೆ (ತದಂಘ್ರಿಪದ ದಳಂ ನವಕುಸುಮಾಳಿಗಳೆನಿಸಿದುವು ಅವಿರಳತರ ರತ್ನಪುಷ್ಪ ಧಾರಾಸಾರಂ: ಆದಿಪು, ೧೦. ೩)"
ಧಾರಿಣಿ,"ಭೂಮಿ (ಧಾರಿಣಿಯಂ ಮಗುೞ ಕುಲಪರ್ವತಮಂ ನೆಲೆಯಿಂ ತೆರಳ್ಚಿ: ಪಂಪರಾ, ೯. ೧೩೩); ದೇಶ (ಧಾರಿಣಿಯಂ ಪ್ರಣಯದಿಂ ಇಳೇಶನಿತ್ತೊಡಮೇಂ ಲಕ್ಷ್ಮಣನೀಯನೆಂಬುದನೆಣಿಸಳೇ: ಪಂಪರಾ, ೬. ೧೦೭)"
ಧಾರಿಣೀಧರ,"ಪರ್ವತ (ದಾರುಣ ಧಾರಿಣೀಧರ ಗುಹಾವಳಿಯಿಂ ದೂರವಾರಣಂಗಳಿಂ .. .. ರೌದ್ರಮಪ್ಪ ಕಾಂತಾರದೊಳ್ ಇರ್ಪುದೊಂದು ಹರಿ: ಪಂಚತಂತ್ರ, ೨೦೭)"
ಧಾರೆ,"ಆಯುಧಧ ಅಲಗು (ಇರ್ಪತ್ತೊಂದು ಸೂೞ್ವರಂ ಪೇೞೆ ಪೆಸರಿಲ್ಲದಂತು ಕೊಂದು ತಂದೆಯ ಪಗೆಗೆಂದಲ್ಲಿಯೆ ತಂದು ನಿಜನಿಶಿತಪರಶುಧಾರೆಗಳಿಂ ನೆತ್ತರ್ ಸೂಸಿ ಪಾಯೆ ಕಡಿದು: ಪಂಪಭಾ, ೯. ೧೦೪ ವ); ಪ್ರವಾಹ (ಅವರ ನೆತ್ತರ ಧಾರೆಯೊಳ್ ತೀವಿ ತನ್ನ ತಾಯಂ ನೀರಿೞಪಲುಂ ತಾನುಂ ಮಿಂದು ತಂದೆಗೆ ನೀರ್ಗುಡಲುಂ ಎಂದು ಮಾಡಿದ: ಪಂಪಭಾ, ೯. ೧೦೪ ವ)"
ಧಾರೆಗೆದಱು,"ಪ್ರವಾಹದಂತೆ ಹರಡಿಕೊ (ಧಾರೆಗೆದಱ ಪೇರೈಸಿ ಸೂಸುವ ಉಭಯಕಟತಟದ ಸೊರ್ಕುಕದಡಿನ ತೆರ್ಕೆಗಡಲ್ಗಳ್: ಅನಂತಪು, ೧೩. ೨೧ ವ)"
ಧಾರ್ತರಾಷ್ಟ್ರ,"ಕೌರವ, ಧೃತರಾಷ್ಟ್ರನ ಮಗ, ದುರ್ಯೋಧನ (ಅದ್ಭುತನಟನಿಟಿಲಾಳೋಲಕೀಲಾಕ್ಷಿವೊಲ್ ದಳ್ಳಿಸೆ ಕೋಪಾರಕ್ತನೇತ್ರಂ ನಿಜಭುಜಗದೆಯಂ ತೂಗಿದಂ ಧಾರ್ತರಾಷ್ಟ್ರಂ: ಗದಾಯು, ೭. ೩೦); ಕೊಕ್ಕು ಕಾಲುಗಳು ಕಪ್ಪಾಗಿರುವ ಒಂದು ಬಗೆಯ ಹಂಸ (ಚರಣಾನನಂಗಳ್ ಆಧೂಸರಮಾಗಿರೆ ಮಲ್ಲಿಕಾಕ್ಷಂ ಅವಱೊಳ್ ಕರ್ಪೊಂದಿರೆ ಧಾರ್ತರಾಷ್ಟ್ರಂ ತಾಮ್ರರುಚಿಯಾದಂದು ರಾಜಹಂಸನೆನಿಕ್ಕುಂ: ಅಭಿಧಾವ, ೧೯. ೧೯)"
ಧಾರ್ಮಿಕ,"ಉಪಾಸಕ, ಸಾಧಕ (ಹಾಸ್ಯ ಬೀಭತ್ಸಾದಿ ನಾನಾ ರಸಂಗಳಿಂದೊಂದಿದ ಜರತ್ ದ್ವರವಿಳ ಧಾರ್ಮಿಕಜನಂಗಳಿಂ: ಕಾದಂಬ, ೮. ೪)"
ಧಾರ್ಷ್ಡ್ಯ,"ದಿಟ್ಟತನ (ಸ್ತವಂಗೆಯ್ವುದದೆಮಗೆ ದಲ್ ಗೌರವಂ ಬಿನ್ನಪಂಗೆಯ್ವುದೆ ಧಾರ್ಷ್ಟ್ಯಂ: ಕಾದಂಬ, ೬. ೧೨೩)"
ಧಾವಳಿ,"ಮಡಿಬಟ್ಟೆ (ಪಾರ್ವಂ ಧಾವಳಿಯಂ ಹಿಳಿದು ನಭದೊಳ್ ಒಣಗಿಕ್ಕಿದೊಡೆ: ಸಮಯಪ, ೧೨. ೩೨)"
ಧಾಳಾಧಾಳಿ,"ಧಾವಿಸಿ ಬರು (ದೇವತಾರಾಧನೆಗೆ ಕಾಲಾತಿಕ್ರಮಮಾಗಲೀಯದೆ ಧಾಳಾಧಾಳಿಯಲ್ಲಿ ಬರ್ಪ ಪರಿಚಾರಕರ ನೆರವಿಯುಮಂ: ಪಂಚತಂತ್ರ, ೧೯೦ ವ)"
ಧಿಕ್ಕರಿಸು,"ನಿಂದಿಸು (ಪಿರಿಯರೆವೆಂದು ಧಿಕ್ಕರಿಸಿ ಬಯ್ವುದು ತಕ್ಕುದೆ: ಶಬ್ದಮದ, ೩೨೧, ಪ್ರ ೨)"
ಧಿರು,"ಭಲೆ (ಧಿರು ಮಾಧವಿಯೂರ್ವಸಿ ಹೋಯಿರೆ ನಚ್ಚಣಿ ರಂಭೆ ಭಲ ತಿಲೋತ್ತಮೆ .. .. ಎನೆ ಪೊಗರಲ್ತೆ ಸುರಭರತಿಯರ್: ಅನಂತಪು, ೪. ೯೧)"
ಧಿಷಣ,"ಪ್ರತಿಭಾವಂತ (ಧಿಷಣರ ಕೃತಿಗಳೊಳೆಸವ ಅಭಿಲಷಿತಗುಣಂಗಳನೆ ಬಿಸುಟು ಮಾತ್ಸರ್ಯ ಮಹಾವಿಷಮಮತಿಯಿಂದೆ ದೋಷಾಮಿಷಮನೆ ಪೊರ್ದಿರ್ಪುವಲ್ತೆ ಕುಕವಿಬಕಂಗಳ್: ಆದಿಪು, ೧. ೨೨)"
ಧಿಷ್ಣ್ಯ,"(ಆ ಪುರವರೇಣ್ಯಂ ಧಿಷ್ಣ್ಯಮಾಗಿಯುಂ ನಕ್ತಂಚರಯುಕ್ತಮಲ್ತು ಅಗಣ್ಯ ಪುಣ್ಯಜನಮಯಮಾಗಿಯುಂ ವಿಬುಧರಹಿತಮಲ್ತು: ಶಾಂತೀಶ್ವಪು, ೧. ೧೩೨ ವ)"
page,8
